id,name,released,rating,platforms,genres,tags,esrb_rating,developers,metacritic,playtime,background_image
28199,Ori and the Will of the Wisps,2020-03-10,4.44,"Xbox One, PC, Nintendo Switch, Xbox Series S/X","Action, Adventure, Platformer","Singleplayer, Steam Achievements, Full controller support, Steam Cloud, Atmospheric, Great Soundtrack, Story Rich, Open World, Fantasy, Difficult, Exploration, Action-Adventure, Cute, Metroidvania, Puzzle-Platformer, Emotional, Masterpiece, Beautiful, Souls-like",Everyone,Moon Studios,91.0,11,https://media.rawg.io/media/games/718/71891d2484a592d871e91dc826707e1c.jpg
28559,Dragon Age: Inquisition,2014-11-18,3.79,"Xbox 360, PlayStation 3, PlayStation 4, Xbox One, PC","Action, RPG, Strategy","Singleplayer, Steam Achievements, Multiplayer, Full controller support, Atmospheric, Great Soundtrack, RPG, Co-op, Story Rich, Open World, Third Person, Online Co-Op, Fantasy, Female Protagonist, Action RPG, Nudity, War, Character Customization, Choices Matter, combat, Sexual Content, Steam Trading Cards, battle, character, Dragons, CRPG, explore, race, Classes",Mature,"BioWare, BioWare Edmonton",86.0,4,https://media.rawg.io/media/games/260/26023c855f1769a93411d6a7ea084632.jpeg
23322,Surviving Mars,2018-03-14,3.47,"PlayStation 4, Xbox One, PC, macOS, Linux","Strategy, Simulation","Singleplayer, Steam Achievements, cooperative, Sci-fi, Space, City Builder, Mars",Everyone 10+,"Haemimont Games, Paradox Interactive",75.0,4,https://media.rawg.io/media/games/08b/08b2eee52a9876a48b955e5149affe5b.jpg
274762,The Outer Worlds,2019-10-25,3.86,"PlayStation 4, PC, Nintendo Switch, Xbox One","Action, Shooter, Adventure, RPG","Singleplayer, Full controller support, RPG, Story Rich, Open World, First-Person, Sci-fi, FPS, Action RPG, Space, role-playing, Choices Matter",,Obsidian Entertainment,80.0,8,https://media.rawg.io/media/games/704/704f831d2d132e9614931f1c4eab9e86.jpg
11276,Call of Duty: Modern Warfare 3,2011-11-08,3.77,"PC, macOS, Wii, Xbox 360, PlayStation 3, iOS, Xbox One","Action, Shooter","Singleplayer, Steam Achievements, Multiplayer, Steam Cloud, Co-op, cooperative, First-Person, FPS, Online Co-Op, Survival, Controller, Zombies, War, Military, Valve Anti-Cheat enabled, Linear",Mature,"Aspyr Media, Raven Software, Treyarch, Infinity Ward, Sledgehammer Games, Neversoft Entertainment",85.0,8,https://media.rawg.io/media/games/e9c/e9c042d14515eb3ff7cb4db9fe78e435.jpg
58753,Forza Horizon 4,2018-10-02,4.37,"PC, Xbox One, Xbox Series S/X","Racing, Arcade","Singleplayer, Steam Achievements, Multiplayer, Full controller support, Steam Cloud, Atmospheric, Great Soundtrack, Co-op, Open World, First-Person, Online Co-Op, Exploration, Sandbox, PvP, Cross-Platform Multiplayer, Family Friendly, exclusive, Realistic, Cinematic, VR, Online PvP, Steam Trading Cards, 3rd-Person Perspective, Driving, explore, Offroad, street racing, w10 exclusive, winter, autumn, extreme",Everyone,Playground Games,90.0,13,https://media.rawg.io/media/games/786/7863e587bac630de82fca50d799236a9.jpg
15834,The Walking Dead: Season 2,2013-12-16,4.06,"macOS, PC, iOS, Android, PS Vita, PlayStation 3, Xbox 360, Nintendo Switch, PlayStation 4, Xbox One","Action, Adventure","Singleplayer, Full controller support, Atmospheric, Story Rich, Horror, Gore, Female Protagonist, Survival, Zombies, Point & Click, Post-apocalyptic, Choices Matter, Mature, Cinematic, Drama, Episodic, Comic Book, Choose Your Own Adventure, Quick-Time Events",Mature,Telltale Games,80.0,10,https://media.rawg.io/media/games/471/4712c9ac591f556f553556b864a7e92b.jpg
22781,Syberia 2,2004-03-30,3.88,"iOS, Xbox, Android, PlayStation 3, PlayStation 2, Xbox 360, Nintendo Switch, macOS, PC","Adventure, Puzzle","Singleplayer, Atmospheric, Great Soundtrack, Story Rich, Classic, Female Protagonist, Point & Click, Mystery, Story, Steampunk, puzzles, Movie, factory, Dreams",Teen,Microids,80.0,5,https://media.rawg.io/media/games/c00/c003705c0eaed100397ae408b7b89e90.jpg
752,SMITE,2015-08-19,3.05,"PlayStation 4, Nintendo Switch, Xbox One, macOS, PC",Action,"Steam Achievements, Multiplayer, steam-trading-cards, RPG, Co-op, cooperative, Third Person, Funny, Survival, Free to Play, PvP, Nudity, Team-Based, Competitive, MMORPG, MOBA, Mythology, e-sports",,Hi-Rez Studios,83.0,3,https://media.rawg.io/media/games/cc7/cc77035eb972f179f5090ee2a0fabd99.jpg
58617,Borderlands 3,2019-09-13,3.88,"Nintendo Switch, PC, Xbox One, PlayStation 4, PlayStation 5, Xbox Series S/X","Action, Shooter, Adventure, RPG","Singleplayer, Steam Achievements, Multiplayer, Full controller support, Steam Cloud, Atmospheric, Great Soundtrack, RPG, Co-op, Open World, cooperative, First-Person, FPS, Online Co-Op, Gore, Exploration, Violent, Split Screen, Local Co-Op, Action-Adventure, Local Multiplayer, Cross-Platform Multiplayer, Space, role-playing, Nudity, Steam Trading Cards, Driving, online, Loot, friends, console, Epic, Masterpiece, offline, Western, Co-op Campaign, skill, looter shooter, Solo, planets, guns, LAN Co-op, Team, trees, wasteland",Mature,"2K, Gearbox Software",83.0,11,https://media.rawg.io/media/games/9f1/9f1891779cb20f44de93cef33b067e50.jpg
3371,Dark Souls II: Scholar of the First Sin,2015-04-01,4.15,"PlayStation 4, Xbox One, PC","Action, RPG","Singleplayer, Steam Achievements, Multiplayer, Full controller support, Atmospheric, RPG, Co-op, Story Rich, cooperative, Third Person, Fantasy, Difficult, Action RPG, Dark, PvP, Hack and Slash, Character Customization, Dark Fantasy, Medieval, Remake, Lore-Rich",Mature,"BANDAI NAMCO Entertainment America, FromSoftware",79.0,25,https://media.rawg.io/media/games/8fc/8fc59e74133fd8a8a436b7e2d0fb36c2.jpg
4440,Deus Ex: Human Revolution,2011-08-22,4.37,"PlayStation 3, Xbox One, PC, macOS, Xbox 360","Action, RPG","Stealth, Cyberpunk",Mature,Eidos Montreal,89.0,17,https://media.rawg.io/media/games/81e/81e6c6819d4322caf375b6735c3043ec.jpg
16113,Sleeping Dogs,2012-08-14,4.13,"PC, Xbox 360, PlayStation 3","Action, Adventure","Singleplayer, Multiplayer, Full controller support, Atmospheric, Great Soundtrack, RPG, Story Rich, Open World, Third Person, Sandbox, Violent, Third-Person Shooter, Parkour, Crime, Driving, Martial Arts",Mature,"United Front Games, Square Enix London Studios",81.0,14,https://media.rawg.io/media/games/3d9/3d9bac98d79bcd2d445f829e8d6be902.jpg
306124,Borderlands Game of the Year Enhanced,2019-04-03,3.79,"PC, Nintendo Switch, PlayStation 4, Xbox One","Action, Shooter, RPG","Singleplayer, Steam Achievements, Multiplayer, Steam Cloud, Atmospheric, RPG, Open World, cooperative, First-Person, Partial Controller Support, FPS, Online Co-Op, Gore, Exploration, Violent, Post-apocalyptic, Sexual Content, Dark Humor, Loot, Role Playing Game, humor, meat",Mature,"Gearbox Software, Blind Squirrel Games",78.0,3,https://media.rawg.io/media/games/df9/df988191048e92cf86dabd2987c47b62.jpg
18336,Alan Wake's American Nightmare,2012-02-22,3.41,"Xbox 360, PC, Xbox One","Action, Shooter","Singleplayer, Full controller support, Atmospheric, Story Rich, Third Person, Horror, Survival, Controller, Third-Person Shooter, Survival Horror, controller support, Mystery, Short, Cinematic, Detective, Supernatural, Thriller",,Remedy Entertainment,73.0,3,https://media.rawg.io/media/games/0b3/0b34647c42271600399b93d19b10f1aa.jpg
4101,Bayonetta,2009-06-23,4.3,"PlayStation 4, PlayStation 3, Xbox 360, Wii U, PC, Xbox One, Nintendo Switch","Action, Adventure","Singleplayer, Steam Achievements, Full controller support, Steam Cloud, Atmospheric, steam-trading-cards, Great Soundtrack, Third Person, Fantasy, Gore, Classic, Female Protagonist, Comedy, Anime, Nudity, Hack and Slash, Mature, Fast-Paced, Sexual Content, Beat 'em up, Character Action Game, Spectacle fighter",Mature,Platinum Games,90.0,5,https://media.rawg.io/media/games/bee/bee483efadcf9d7e657e52184316a34e.jpg
2728,Tom Clancy’s The Division,2016-03-07,3.7,"PC, Xbox One, PlayStation 4","Action, Shooter, RPG","Singleplayer, Multiplayer, Atmospheric, steam-trading-cards, RPG, Co-op, Open World, cooperative, Third Person, FPS, Online Co-Op, Sandbox, Survival, Tactical, Third-Person Shooter, Post-apocalyptic, MMORPG",Mature,"Ubisoft, Massive Entertainment",80.0,27,https://media.rawg.io/media/games/c73/c73c4ffebfe968ba0982a56c2b5020ef.jpg
12756,"Warhammer 40,000: Space Marine",2011-09-05,3.47,"PC, PlayStation 3, Xbox 360","Action, Shooter","Singleplayer, Steam Achievements, Multiplayer, Full controller support, Atmospheric, Great Soundtrack, Co-op, Story Rich, cooperative, Third Person, Sci-fi, Online Co-Op, Gore, Steam Leaderboards, Controller, Third-Person Shooter, Hack and Slash, Futuristic, Dystopian, Games Workshop, Warhammer 40K",Adults Only,Relic Entertainment,74.0,5,https://media.rawg.io/media/games/ac2/ac25b5cef220bf5b8d052e0978451cab.jpg
45821,Frostpunk,2018-04-24,4.18,"Xbox One, Nintendo Switch, PlayStation 4, PC","Strategy, Simulation","Singleplayer, Atmospheric, Difficult, Survival, Dark, Post-apocalyptic, Choices Matter, Building, Management, Real-Time with Pause, Resource Management, Economy, City Builder",Mature,11 Bit Studios,85.0,6,https://media.rawg.io/media/games/a88/a886c37bf112d009e318b106db9d420a.jpg
14446,Call of Duty: Black Ops II,2012-11-13,3.96,"Wii U, Xbox One, Xbox 360, PlayStation 3, PC","Action, Shooter","Singleplayer, Steam Achievements, Multiplayer, Full controller support, Steam Cloud, Atmospheric, steam-trading-cards, Great Soundtrack, Co-op, cooperative, First-Person, Sci-fi, Horror, FPS, Online Co-Op, Steam Leaderboards, Survival, Controller, Tactical, Zombies, War, Team-Based, Futuristic, Valve Anti-Cheat enabled, Story, character, death",Mature,Treyarch,74.0,5,https://media.rawg.io/media/games/8ee/8eed88e297441ef9202b5d1d35d7d86f.jpg
22121,Celeste,2018-01-25,4.38,"Xbox One, PC, macOS, Nintendo Switch, PlayStation 4, Linux","Indie, Platformer","Singleplayer, Steam Achievements, Full controller support, Steam Cloud, Story Rich, 2D, Horror, Female Protagonist, celeste, xna, miniboss, fna, towerfall, matt-makes-games, great-graphics, character-development",Everyone 10+,"Matt Makes Games, Extremely OK Games, Noel",91.0,6,https://media.rawg.io/media/games/594/59487800889ebac294c7c2c070d02356.jpg
4094,Metal Gear Rising: Revengeance,2013-02-19,4.25,"PlayStation 3, Xbox 360, PC, Android, Xbox One",Action,"Singleplayer, Steam Achievements, Full controller support, Steam Cloud, Great Soundtrack, Story Rich, Third Person, Sci-fi, Gore, Difficult, Stealth, Hack and Slash, Replay Value, Fast-Paced, Cyberpunk, Beat 'em up, Ninja, Mechs, Character Action Game, Swordplay, Spectacle fighter",Mature,Platinum Games,83.0,6,https://media.rawg.io/media/games/8e6/8e699e91cf77c2060b6d515e2135b1b1.jpg
9966,Dead by Daylight,2016-06-14,3.5,"Nintendo Switch, PC, PlayStation 4, Xbox One, PlayStation 5",Action,"Steam Achievements, Multiplayer, Steam Cloud, Atmospheric, steam-trading-cards, Co-op, First-Person, Third Person, Partial Controller Support, Horror, Online Co-Op, Gore, Difficult, Survival, Comedy, Violent, Stealth, Survival Horror, Mature, Team-Based, online, Blood, character, console, offline, work, death, escape, sacrifice",Mature,"Behaviour Interactive, Behaviour Digital",72.0,10,https://media.rawg.io/media/games/e11/e11325e2f89151d31f612e38dee3b6a0.jpg
2597,LEGO The Lord of the Rings,2012-10-30,3.55,"PC, iOS, Nintendo DS, PlayStation 3, Nintendo 3DS, Xbox 360, Wii, PS Vita, Android","Action, Adventure","Singleplayer, Steam Achievements, Multiplayer, Full controller support, Steam Cloud, Co-op, Open World, cooperative, Third Person, Fantasy, Funny, Comedy, Split Screen, Local Co-Op, Controller, Local Multiplayer, Family Friendly, 3D Vision, LEGO",Everyone 10+,"Warner Bros. Interactive, Traveller's Tales",80.0,2,https://media.rawg.io/media/games/89a/89a700d3c6a76bd0610ca89ccd20da54.jpg
30899,Mafia: The City of Lost Heaven,2002-08-28,4.35,"Xbox, PlayStation 2, PC",Action,"Singleplayer, Story Rich, Open World, Third Person, Classic, Violent, Action-Adventure, mafia, 1930s, 30s",Mature,Illusion Softworks,88.0,2,https://media.rawg.io/media/games/74c/74ca0ec569682a150f3c6f9f661fb6a5.jpg
9671,Rust,2018-02-09,3.37,"PlayStation 4, Xbox One, PC, macOS, Linux","Action, Shooter, RPG, Massively Multiplayer, Indie","Multiplayer, Co-op, Open World, cooperative, First-Person, FPS, Online Co-Op, Sandbox, Survival, Early Access, Steam Workshop, PvP, Cross-Platform Multiplayer, Nudity, In-App Purchases, Survival Horror, Post-apocalyptic, Crafting, Building, Valve Anti-Cheat enabled, mmo",Mature,Facepunch Studios,66.0,15,https://media.rawg.io/media/games/447/4470c1e76f01acfaf5af9c207d1c1c92.jpg
2115,Overcooked,2016-08-01,4.07,"PlayStation 4, Nintendo Switch, Xbox One, PC","Simulation, Arcade, Casual, Indie","Singleplayer, Steam Achievements, Multiplayer, Full controller support, Steam Cloud, steam-trading-cards, Great Soundtrack, Co-op, cooperative, Funny, Difficult, Split Screen, Local Co-Op, Local Multiplayer, Family Friendly, Colorful, Memes, 4 Player Local, Co-op Campaign",Everyone,"Team17 Digital, Ghost Town Games",81.0,4,https://media.rawg.io/media/games/270/270b412b66688081497b3d70c100b208.jpg
4123,Batman: Arkham Asylum,2009-08-25,4.4,"Nintendo Switch, macOS, PC, PlayStation 4, PlayStation 3, Xbox 360, Xbox One",Action,"Exploration, Stealth, puzzles, hero, island",Teen,Rocksteady Studios,91.0,13,https://media.rawg.io/media/games/d56/d564ee964eb3c17892b3b35dd607f836.jpg
42895,Assassin's Creed Syndicate,2015-10-23,3.66,"PC, Xbox One, PlayStation 4",Action,"Singleplayer, Multiplayer, Atmospheric, Great Soundtrack, Co-op, Story Rich, Open World, cooperative, Third Person, Partial Controller Support, Funny, Gore, Female Protagonist, Stealth, Historical, Parkour, Steampunk, Assassin, Illuminati",Mature,"Ubisoft Montreal, Ubisoft Quebec, Ubisoft Singapore",74.0,22,https://media.rawg.io/media/games/9f1/9f189c639f70f91166df415811a8b525.jpg
13247,Human: Fall Flat,2016-07-22,3.82,"Android, Linux, macOS, PC, iOS, PlayStation 4, Xbox One, Nintendo Switch","Action, Indie, Puzzle","Singleplayer, Steam Achievements, Multiplayer, Full controller support, Steam Cloud, Co-op, Open World, cooperative, Funny, Sandbox, Survival, Split Screen, Local Co-Op, Local Multiplayer, stats, controller support, Physics, Memes, Puzzle-Platformer, 3D Platformer, soft-body physics",Everyone,"505 Games, Curve Digital, No Brakes Games",70.0,5,https://media.rawg.io/media/games/74d/74dafeb9a442b87b9dd4a1d4a2faa37b.jpg
28152,STAR WARS Battlefront II,2017-11-17,3.57,"PlayStation 4, PC, Xbox One","Action, Shooter, Adventure","Singleplayer, Steam Achievements, Multiplayer, Co-op, cooperative, First-Person, Third Person, Sci-fi, FPS, Online Co-Op, Tactical, Third-Person Shooter, PvP, Space, Character Customization, combat, Aliens, Online PvP, Steam Trading Cards, Star Wars, Vehicular Combat",Teen,Electronic Arts DICE,74.0,4,https://media.rawg.io/media/games/f54/f54e9fb2f4aac37810ea1a69a3e4480a.jpg
17857,S.T.A.L.K.E.R.: Shadow of Chernobyl,2007-03-19,4.28,"Xbox Series S/X, PC, Xbox One, Nintendo Switch, PlayStation 4","Action, Shooter, Adventure, RPG","Singleplayer, Multiplayer, Atmospheric, RPG, Open World, First-Person, Sci-fi, Horror, FPS, Difficult, Classic, Sandbox, Survival, Moddable, Survival Horror, Post-apocalyptic, Based On A Novel, Inventory Management",Adults Only,GSC Game World,82.0,3,https://media.rawg.io/media/games/348/348640e78a7fcd4bb7dcad4fea014eeb.jpg
14962,Dark Souls: Prepare To Die Edition,2012-08-23,4.36,"Xbox 360, PlayStation 3, PC","Action, RPG","Singleplayer, Steam Achievements, Multiplayer, Atmospheric, Great Soundtrack, RPG, Story Rich, Open World, Third Person, Partial Controller Support, Fantasy, Difficult, Exploration, Action RPG, Dark, Character Customization, Replay Value, Dark Fantasy, Medieval, Lore-Rich",Mature,FromSoftware,85.0,14,https://media.rawg.io/media/games/511/5116b4524cea34c6b3f12e0ca027d850.jpg
19569,Hitman: Blood Money,2006-05-29,4.31,"Xbox 360, PlayStation 4, PC, PlayStation 2, PlayStation 3, Xbox","Action, Shooter","Singleplayer, Atmospheric, Great Soundtrack, First-Person, Third Person, Difficult, Classic, Sandbox, Stealth, Third-Person Shooter, Dark, Replay Value, Crime, Assassin, Cult Classic",,"Square Enix, IO Interactive",82.0,2,https://media.rawg.io/media/games/233/233cdc08cce0228f6f35222eca3bff92.jpg
750,FINAL FANTASY XV,2016-11-29,3.87,"PlayStation 4, PC, Xbox One",RPG,"RPG, Fantasy, combat, Story, battle, friends, Tanks, night",Teen,Square Enix,82.0,5,https://media.rawg.io/media/games/2ee/2eeed8524931b4fae1e4a40d0e5443b5.jpg
50778,A Way Out,2018-03-23,4.12,"PC, Xbox One, PlayStation 4","Action, Adventure","Steam Achievements, Multiplayer, Full controller support, Atmospheric, Co-op, Story Rich, cooperative, Third Person, Online Co-Op, Violent, Split Screen, Stealth, Local Co-Op, Action-Adventure, Nudity, Cinematic, Sexual Content, Crime, Steam Trading Cards, Emotional, Remote Play Together, Shared/Split Screen Co-op, Remote Play on TV, Remote Play on Tablet, Conversation, Remote Play on Phone, prison, ea play",Mature,"Electronic Arts, Hazelight",78.0,6,https://media.rawg.io/media/games/473/473bd9a5e9522629d6cb28b701fb836a.jpg
11312,The Long Dark,2014-09-22,3.91,"PlayStation 4, Xbox One, Nintendo Switch, PC, macOS, Linux","Action, Adventure, Simulation, Indie","Singleplayer, Steam Achievements, Multiplayer, Full controller support, Steam Cloud, Atmospheric, steam-trading-cards, Open World, First-Person, Horror, Difficult, Steam Leaderboards, Exploration, Sandbox, Female Protagonist, Survival, Early Access, Survival Horror, Post-apocalyptic, Crafting, Walking Simulator, overlay, in development",Teen,Hinterland Studio,76.0,5,https://media.rawg.io/media/games/fd2/fd20a68d7ef195855588c937865dd0a7.jpg
14016,Tropico 4,2011-08-24,3.5,"PC, Xbox 360, Xbox One, macOS","Strategy, Simulation","Singleplayer, Steam Achievements, Atmospheric, steam-trading-cards, Great Soundtrack, Funny, Sandbox, Comedy, Building, RTS, Management, Real-Time with Pause, Resource Management, Economy, City Builder, Political, Cold War, Politics, God Game, Capitalism",,"Feral Interactive, Haemimont Games",78.0,4,https://media.rawg.io/media/games/d1e/d1e70ce3762efcfc170c6bd067d7e9e3.jpg
250,The Binding of Isaac: Rebirth,2014-11-03,4.33,"Xbox One, macOS, Linux, Nintendo Switch, Nintendo 3DS, Wii U, PlayStation 4, PS Vita, iOS, PC","Action, RPG","Singleplayer, Steam Achievements, Full controller support, Steam Cloud, Atmospheric, steam-trading-cards, Great Soundtrack, Co-op, cooperative, 2D, Horror, Gore, Difficult, Split Screen, Local Co-Op, Pixel Graphics, Dark, Replay Value, Roguelike, Remake, Roguelite, Dungeon Crawler, Procedural Generation, Twin Stick Shooter",Mature,"Nicalis, Edmund McMillen",86.0,30,https://media.rawg.io/media/games/926/926928beb8a9f9b31cf202965aa4cbbc.jpg
16359,Divinity: Original Sin - Enhanced Edition,2015-10-27,4.26,"PC, Linux, macOS, PlayStation 4, Xbox One","RPG, Indie","Singleplayer, Steam Achievements, Multiplayer, Full controller support, Steam Cloud, steam-trading-cards, Great Soundtrack, RPG, Co-op, Story Rich, Open World, cooperative, Fantasy, Split Screen, Local Co-Op, Cross-Platform Multiplayer, Character Customization, Turn-Based, Captions available, Isometric, Turn-Based Strategy, Turn-Based Combat, CRPG, Party-Based RPG",Mature,Larian Studios,94.0,8,https://media.rawg.io/media/games/33b/33b825c76382931df0fd8ecddf5caebe.jpg
2518,Max Payne,2001-07-25,4.45,"PC, PlayStation 3, Xbox, Classic Macintosh, PlayStation 2, Xbox 360, PlayStation 4","Action, Shooter","Singleplayer, Classic, Third-Person Shooter, Noir, first person mod",Mature,Remedy Entertainment,89.0,2,https://media.rawg.io/media/games/2f5/2f5eb72fe45540e93ac2726877551a20.jpg
274480,Mortal Kombat 11,2019-04-22,3.96,"Nintendo Switch, Xbox One, PC, PlayStation 4, Xbox Series S/X, PlayStation 5","Action, Adventure, Fighting","Singleplayer, Multiplayer, Atmospheric, Gore, Violent, Online multiplayer, Blood",Mature,"NetherRealm Studios, QLOC, Shiver Games",82.0,9,https://media.rawg.io/media/games/eb5/eb514db62d397c64288160d5bd8fd67a.jpg
3346,Wolfenstein: The Old Blood,2015-05-04,4.01,"Xbox One, PlayStation 4, PC","Action, Shooter","Singleplayer, Steam Achievements, Multiplayer, Steam Cloud, Atmospheric, Story Rich, First-Person, Sci-fi, Partial Controller Support, Horror, FPS, Funny, Gore, Steam Leaderboards, Stealth, Zombies, War, Mature, Blood, World War II, Alternate History",,"Bethesda Softworks, Machine Games",76.0,7,https://media.rawg.io/media/games/f14/f1422eacab98c5f85a5123da4e9d9e89.jpg
17803,Ryse: Son of Rome,2013-11-22,3.59,"Xbox One, PC","Action, Adventure","Singleplayer, Multiplayer, Full controller support, Atmospheric, RPG, Co-op, Open World, cooperative, Third Person, Fantasy, Gore, stats, Nudity, Hack and Slash, War, Short, Historical, Linear, Quick-Time Events, Benchmark, Rome",Mature,Crytek,61.0,6,https://media.rawg.io/media/games/736/736c0eaec96d848d7824b33298a182f2.jpg
10449,Darksiders II Deathinitive Edition,2015-11-05,3.79,"PlayStation 4, Xbox One, Nintendo Switch, PC","Action, RPG","Singleplayer, Steam Achievements, Multiplayer, Full controller support, Steam Cloud, steam-trading-cards, Great Soundtrack, RPG, Story Rich, Open World, Third Person, Fantasy, Gore, Steam Leaderboards, Action RPG, Controller, Hack and Slash, Post-apocalyptic, Dark Fantasy, Parkour, Loot, Spectacle fighter",,"THQ Nordic, Vigil Games, Gunfire Games",75.0,9,https://media.rawg.io/media/games/cfe/cfe5960b5caca432f3575fc7d8ff736b.jpg
13628,Dear Esther: Landmark Edition,2017-02-14,3.31,"PlayStation 4, Xbox One, PC, macOS","Adventure, Casual, Indie","Singleplayer, Steam Achievements, Full controller support, Steam Cloud, Atmospheric, Great Soundtrack, First-Person, Exploration, Walking Simulator, Commentary available",,"The Chinese Room, Robert Briscoe",,1,https://media.rawg.io/media/screenshots/b20/b20a20205954f9765e82298dbd41e48a.jpg
15858,Star Wars: Knights of the Old Republic II – The Sith Lords,2004-12-06,4.37,"Xbox, Xbox 360, Linux, macOS, PC, Nintendo Switch, Android","Adventure, RPG","Singleplayer, Steam Achievements, Full controller support, Steam Cloud, Atmospheric, RPG, Story Rich, Third Person, Sci-fi, Classic, Female Protagonist, Steam Workshop, Space, role-playing, Moddable, Character Customization, Turn-Based, Choices Matter, Multiple Endings, Turn-Based Combat, Real-Time with Pause, Party-Based RPG, Star Wars",Teen,"Aspyr Media, Obsidian Entertainment, Lucasfilm",85.0,4,https://media.rawg.io/media/games/046/0464f4a36cd975a37c95b93b06058855.jpg
12320,Prison Architect,2015-10-05,3.72,"Xbox One, PC, macOS, Linux, Nintendo Switch, PlayStation 4","Strategy, Simulation, Indie","Singleplayer, Steam Achievements, Steam Cloud, steam-trading-cards, 2D, Funny, Sandbox, Comedy, Steam Workshop, Includes level editor, Moddable, Replay Value, Building, RTS, Top-Down, overlay, Management, achievements, Base Building, Resource Management, Economy, City Builder",Mature,"Double Eleven, Introversion Software",83.0,5,https://media.rawg.io/media/games/6bc/6bc79f5bc023b1e6938f6eaf9926f073.jpg
10092,Minion Masters,2019-05-24,2.3,"Xbox One, PC","Action, Strategy, Indie","Singleplayer, Steam Achievements, Multiplayer, Steam Cloud, steam-trading-cards, RPG, Co-op, Online Co-Op, Fantasy, Gore, Violent, Online multiplayer, Controller, PvP, In-App Purchases, Competitive, Top-Down, Blood, Card Game, Real-Time, Real Time Tactics, Strategy RPG, Trading Card Game",,BetaDwarf,,5,https://media.rawg.io/media/games/e4a/e4ab7f784bdc38c76ce6e4cef9715d18.jpg
50781,Sea of Thieves,2018-03-20,3.68,"PC, PlayStation 5, Xbox Series S/X, Xbox One","Action, Adventure, Massively Multiplayer","Singleplayer, Steam Achievements, Multiplayer, Full controller support, Co-op, Open World, cooperative, First-Person, Online Co-Op, Funny, PvP, Cross-Platform Multiplayer, In-App Purchases, exclusive, Online PvP, PvE, Pirates, Sailing, sea, w10 exclusive",Teen,Rare,68.0,13,https://media.rawg.io/media/games/5f6/5f61441e6338e9221f96a8f4c64c7bb8.jpg
3554,The Evil Within,2014-10-12,3.97,"PlayStation 3, PlayStation 4, Xbox 360, PC, Xbox One","Action, Shooter, Adventure","Singleplayer, Steam Achievements, Full controller support, Steam Cloud, Atmospheric, steam-trading-cards, Story Rich, Open World, Third Person, Horror, Gore, Difficult, Survival, Stealth, Third-Person Shooter, Dark, Zombies, Survival Horror, Captions available, Cinematic, Walking Simulator",Mature,"Bethesda Softworks, Tango Gameworks",68.0,6,https://media.rawg.io/media/games/157/1570121f5c4d240504f1eae5c3854733.jpg
51610,Dark Souls: Remastered,2018-05-23,4.48,"Nintendo Switch, PC, PlayStation 4, Xbox One","Action, RPG","Singleplayer, Steam Achievements, Multiplayer, Full controller support, Atmospheric, Great Soundtrack, RPG, Co-op, Story Rich, Open World, cooperative, Third Person, Difficult, Exploration, Action RPG, Dark, Character Customization, Replay Value, Dark Fantasy, Mature, Lore-Rich",,"FromSoftware, QLOC",84.0,15,https://media.rawg.io/media/games/29c/29c6c21cc0c78cff6f45d23631cc82f4.jpg
10090,Beholder,2016-11-08,3.81,"Nintendo Switch, iOS, Xbox One, PC, macOS, Linux, PlayStation 4, Android","Adventure, RPG, Strategy, Indie","Singleplayer, Steam Achievements, Full controller support, Steam Cloud, Atmospheric, steam-trading-cards, Great Soundtrack, RPG, Story Rich, 2D, Horror, Violent, Stealth, Dark, Point & Click, Choices Matter, Multiple Endings, Dystopian, Political",Teen,"Alawar Entertainment, Warm Lamp Games",75.0,4,https://media.rawg.io/media/games/40a/40ab95c1639aa1d7ec04d4cd523af6b1.jpg
