id,name,released,rating,platforms,genres,tags,esrb_rating,developers,metacritic,playtime,background_image
4161,Far Cry 3,2012-11-28,4.25,"Xbox One, Xbox 360, PlayStation 3, PC, PlayStation 4","Action, Shooter","Singleplayer, Multiplayer, Atmospheric, RPG, Co-op, Story Rich, Open World, cooperative, First-Person, Partial Controller Support, FPS, Online Co-Op, Sandbox, Survival, Stealth, Nudity, Colorful, Crafting, Hunting",Mature,"Ubisoft, Ubisoft Montreal",88.0,16,https://media.rawg.io/media/games/15c/15c95a4915f88a3e89c821526afe05fc.jpg
19487,Alan Wake,2010-05-14,4.09,"Xbox 360, Xbox One, PC","Action, Shooter, Adventure","Singleplayer, Steam Achievements, Full controller support, Steam Cloud, Atmospheric, steam-trading-cards, Great Soundtrack, Story Rich, Open World, Third Person, Horror, Survival, Third-Person Shooter, Dark, Survival Horror, controller support, Mystery, Cinematic, Episodic, Narration, Supernatural, Thriller, psycholoical-horror, enviroment",Teen,Remedy Entertainment,83.0,5,https://media.rawg.io/media/games/5c0/5c0dd63002cb23f804aab327d40ef119.jpg
4332,Spec Ops: The Line,2012-06-26,4.09,"Xbox 360, PlayStation 3, Xbox One, PC","Action, Shooter","Singleplayer, Steam Achievements, Multiplayer, Full controller support, Steam Cloud, Atmospheric, Great Soundtrack, Co-op, Story Rich, Third Person, Horror, Steam Leaderboards, Third-Person Shooter, stats, Dark, Cross-Platform Multiplayer, War, Post-apocalyptic, Mature, Military, Psychological, Based On A Novel, Political, european",Mature,Yager,76.0,5,https://media.rawg.io/media/games/b49/b4912b5dbfc7ed8927b65f05b8507f6c.jpg
3696,Wolfenstein: The New Order,2014-05-19,4.18,"Xbox One, PC, Xbox 360, PlayStation 3, PlayStation 4","Action, Shooter","Singleplayer, Steam Achievements, Multiplayer, Atmospheric, Great Soundtrack, Story Rich, First-Person, Sci-fi, Partial Controller Support, Horror, FPS, Gore, Steam Leaderboards, Stealth, War, Historical, Dystopian, Robots, World War II, Alternate History",Mature,"Bethesda Softworks, Machine Games",81.0,12,https://media.rawg.io/media/games/c80/c80bcf321da44d69b18a06c04d942662.jpg
4386,Saints Row: The Third,2011-11-15,3.95,"Linux, PC, Xbox One, Xbox 360, PlayStation 3","Action, Adventure","Singleplayer, Multiplayer, Great Soundtrack, RPG, Co-op, Open World, cooperative, Third Person, Partial Controller Support, Online Co-Op, Funny, Sandbox, Female Protagonist, Comedy, Third-Person Shooter, Zombies, Character Customization, Crime, Satire",Mature,Volition,84.0,14,https://media.rawg.io/media/games/d69/d69810315bd7e226ea2d21f9156af629.jpg
39,Prey,2017-05-05,4.28,"Xbox One, PC, PlayStation 4","Action, Shooter, RPG","Singleplayer, Steam Achievements, Full controller support, Steam Cloud, Atmospheric, steam-trading-cards, Great Soundtrack, RPG, Story Rich, Open World, First-Person, Sci-fi, Horror, FPS, Exploration, Violent, Stealth, Space, Survival Horror, Futuristic, Aliens, Heist, Immersive Sim",Mature,Arkane Studios,80.0,10,https://media.rawg.io/media/games/e6d/e6de699bd788497f4b52e2f41f9698f2.jpg
4828,Borderlands,2009-10-20,3.82,"PC, Xbox 360, PlayStation 3","Action, Shooter, RPG","Singleplayer, Steam Achievements, Multiplayer, Steam Cloud, RPG, Co-op, Open World, cooperative, First-Person, Sci-fi, Partial Controller Support, FPS, Online Co-Op, Funny, Gore, Comedy, Local Co-Op, Action RPG, Post-apocalyptic, Dark Humor, Loot",Adults Only,"2K, Gearbox Software",81.0,10,https://media.rawg.io/media/games/c6b/c6bfece1daf8d06bc0a60632ac78e5bf.jpg
5563,Fallout: New Vegas,2010-10-19,4.43,"Xbox 360, PC, Xbox One, PlayStation 4, PlayStation 3","Action, Shooter, RPG","Singleplayer, Steam Achievements, Atmospheric, RPG, Story Rich, Open World, First-Person, Third Person, Sci-fi, Partial Controller Support, FPS, Steam Leaderboards, Exploration, Sandbox, Survival, Action RPG, Moddable, Character Customization, Post-apocalyptic, Western",Mature,Obsidian Entertainment,84.0,12,https://media.rawg.io/media/games/995/9951d9d55323d08967640f7b9ab3e342.jpg
12447,The Elder Scrolls V: Skyrim Special Edition,2016-10-27,4.45,"PlayStation 4, PC, Xbox One","Action, RPG","Singleplayer, Steam Achievements, Steam Cloud, Atmospheric, Great Soundtrack, RPG, Story Rich, Open World, First-Person, Third Person, Partial Controller Support, Fantasy, Classic, Female Protagonist, Stealth, Moddable, Character Customization, Magic, Walking Simulator, Remake, Dragons",Mature,Bethesda Game Studios,74.0,9,https://media.rawg.io/media/games/62c/62c7c8b28a27b83680b22fb9d33fc619.jpg
9882,Don't Starve Together,2016-04-21,3.77,"Linux, Xbox One, PlayStation 4, macOS, PC","Action, Simulation, Indie","Singleplayer, Multiplayer, Full controller support, Atmospheric, steam-trading-cards, Co-op, Open World, cooperative, 2D, Horror, Online Co-Op, Funny, Difficult, Sandbox, Survival, Local Co-Op, Steam Workshop, Cross-Platform Multiplayer, Survival Horror, Crafting, Roguelike",,Klei Entertainment,83.0,7,https://media.rawg.io/media/games/dd5/dd50d4266915d56dd5b63ae1bf72606a.jpg
864,Dishonored 2,2016-11-10,4.26,"Xbox One, PC, PlayStation 4","Action, RPG","Singleplayer, Steam Achievements, Full controller support, Steam Cloud, Atmospheric, steam-trading-cards, Great Soundtrack, Story Rich, Open World, First-Person, Gore, Exploration, Female Protagonist, Stealth, Magic, Parkour, Dystopian, Steampunk, Assassin, Illuminati, Heist, Supernatural, Immersive Sim",Mature,"Bethesda Softworks, Arkane Studios",86.0,12,https://media.rawg.io/media/games/f6b/f6bed028b02369d4cab548f4f9337e81.jpg
17540,Injustice: Gods Among Us Ultimate Edition,2013-11-12,3.53,"PlayStation 4, PS Vita, PC, Xbox 360, PlayStation 3","Action, Arcade, Fighting","Singleplayer, Steam Achievements, Multiplayer, Full controller support, Steam Cloud, Atmospheric, steam-trading-cards, Great Soundtrack, Story Rich, 2D, Gore, Steam Leaderboards, Controller, Local Multiplayer, Competitive, Beat 'em up, 3D Vision, 2.5D, Comic Book, Superhero, 2D Fighter, Batman",Mature,"NetherRealm Studios, High Voltage Software, Armature Studio",80.0,5,https://media.rawg.io/media/games/234/23410661770ae13eac11066980834367.jpg
4248,Dishonored,2012-09-25,4.37,"PlayStation 4, PlayStation 3, Xbox 360, PC, Xbox One","Action, Adventure, RPG","Singleplayer, Steam Achievements, Full controller support, Steam Cloud, Atmospheric, RPG, Story Rich, Open World, First-Person, Sci-fi, FPS, Fantasy, Stealth, Dark, Replay Value, Magic, Multiple Endings, Dystopian, Steampunk, Assassin",Mature,"Bethesda Softworks, Arkane Studios",91.0,9,https://media.rawg.io/media/games/4e6/4e6e8e7f50c237d76f38f3c885dae3d2.jpg
12536,Hellblade: Senua's Sacrifice,2017-08-07,4.23,"Xbox One, Nintendo Switch, PlayStation 4, PC","Action, Adventure, Indie","Singleplayer, Steam Achievements, Full controller support, Steam Cloud, Atmospheric, steam-trading-cards, Story Rich, Third Person, Horror, Fantasy, Female Protagonist, Violent, Action-Adventure, Dark, Hack and Slash, Dark Fantasy, Realistic, Walking Simulator, Blood, Psychological, Mythology",Mature,Ninja Theory,83.0,6,https://media.rawg.io/media/games/63f/63f0e68688cad279ed38cde931dbfcdb.jpg
5583,Hitman: Absolution,2012-11-19,3.75,"PlayStation 3, Xbox 360, macOS, PC, Xbox One, PlayStation 4","Action, Shooter","Singleplayer, Multiplayer, Atmospheric, Story Rich, Third Person, Partial Controller Support, Difficult, Stealth, Controller, Tactical, Third-Person Shooter, Replay Value, Cinematic, Crime, Linear, Assassin, Score Attack",Mature,IO Interactive,79.0,7,https://media.rawg.io/media/games/d46/d46373f39458670305704ef089387520.jpg
3144,Super Meat Boy,2010-10-20,3.98,"Linux, Nintendo Switch, Wii U, Xbox 360, PlayStation 4, PS Vita, Android, Web, PC, macOS","Indie, Platformer","Singleplayer, Steam Achievements, Full controller support, steam-trading-cards, Great Soundtrack, 2D, Funny, Gore, Difficult, Steam Leaderboards, Comedy, Pixel Graphics, Controller, Retro, Replay Value, Side Scroller, Fast-Paced, Level Editor, Time Attack, Precision Platformer",,"NVIDIA Lightspeed Studios, Team Meat",87.0,3,https://media.rawg.io/media/games/e04/e04963f3ac4c4fa83a1dc0b9231e50db.jpg
362,For Honor,2017-02-13,3.3,"Xbox One, PlayStation 4, PC","Action, Massively Multiplayer","Singleplayer, Multiplayer, Atmospheric, steam-trading-cards, RPG, Co-op, Story Rich, cooperative, Third Person, Partial Controller Support, Online Co-Op, Fantasy, Gore, Online multiplayer, PvP, Hack and Slash, War, Realistic, Medieval, MOBA, Swordplay",Mature,"Ubisoft, Ubisoft Montreal, Ubisoft Toronto, Ubisoft Quebec, Blue Byte",76.0,8,https://media.rawg.io/media/games/4e0/4e0e7b6d6906a131307c94266e5c9a1c.jpg
430,Grand Theft Auto: Vice City,2002-10-27,4.45,"Android, macOS, PC, iOS, PlayStation 4, PS Vita, PlayStation 2, Xbox",Action,"Singleplayer, Multiplayer, Atmospheric, Great Soundtrack, Open World, Third Person, Partial Controller Support, Funny, Classic, Sandbox, Violent, Third-Person Shooter, Moddable, Mature, Crime, Driving, 1980s, first person mod",Mature,Rockstar North,94.0,2,https://media.rawg.io/media/games/13a/13a528ac9cf48bbb6be5d35fe029336d.jpg
4514,L.A. Noire,2011-05-17,4.16,"PlayStation 4, PlayStation 3, Xbox 360, PC, Xbox One, Nintendo Switch","Action, Adventure","Singleplayer, Atmospheric, RPG, Story Rich, Open World, Third Person, Partial Controller Support, Third-Person Shooter, Nudity, Mystery, Mature, Cinematic, Crime, 3D Vision, Detective, Noir, Investigation",Mature,Team Bondi,83.0,7,https://media.rawg.io/media/games/e2d/e2d3f396b16dded0f841c17c9799a882.jpg
3841,Assassin’s Creed IV: Black Flag,2013-10-29,4.14,"Xbox 360, Xbox One, PC, Nintendo Switch, Wii U, PlayStation 3, PlayStation 4",Action,"Singleplayer, Multiplayer, Atmospheric, RPG, Story Rich, Open World, Third Person, Exploration, Sandbox, Stealth, Action-Adventure, Action RPG, Mature, Historical, Parkour, Assassin, Pirates, Naval",Mature,"Ubisoft, Ubisoft Montreal, Ubisoft Toronto, Ubisoft Bucharest",85.0,25,https://media.rawg.io/media/games/849/849414b978db37d4563ff9e4b0d3a787.jpg
58812,Control,2019-08-27,4.15,"Xbox Series S/X, PlayStation 5, Xbox One, PlayStation 4, PC","Action, Shooter, Adventure","Singleplayer, Full controller support, Atmospheric, Third Person, Sci-fi, Exploration, Female Protagonist, Action-Adventure, Cinematic, Metroidvania, 3rd-Person Perspective, Detective, Supernatural, Abstract, realism, paranormal",Mature,"505 Games, Remedy Entertainment",84.0,6,https://media.rawg.io/media/games/253/2534a46f3da7fa7c315f1387515ca393.jpg
257201,Star Wars Jedi: Fallen Order,2019-11-15,4.14,"PlayStation 4, PC, PlayStation 5, Xbox One","Action, Adventure","Singleplayer, Full controller support, Atmospheric, Story Rich, Third Person, Sci-fi, Difficult, Exploration, Space, Hack and Slash, Metroidvania, 3rd-Person Perspective, Heist, Souls-like, Star Wars, ea play, cinema, lightsaber, Singe-player",Teen,Respawn Entertainment,80.0,8,https://media.rawg.io/media/games/559/559bc0768f656ad0c63c54b80a82d680.jpg
4570,Dead Space (2008),2008-10-13,4.38,"PlayStation 3, PC, Xbox One, Xbox 360","Action, Shooter","Singleplayer, Full controller support, Atmospheric, RPG, Story Rich, Third Person, Sci-fi, Horror, Gore, Survival, Third-Person Shooter, Dark, Space, Zombies, Survival Horror, controller support, Futuristic, Aliens, Silent Protagonist",Mature,"Electronic Arts, Visceral Games, Electronic Arts Redwood Shores",86.0,3,https://media.rawg.io/media/games/ebd/ebdbb7eb52bd58b0e7fa4538d9757b60.jpg
4806,Mass Effect 2,2010-01-26,4.47,"PC, Xbox One, PlayStation 3, Xbox 360","Action, RPG","Singleplayer, Atmospheric, Great Soundtrack, RPG, Story Rich, Third Person, Sci-fi, Classic, Female Protagonist, Action RPG, Third-Person Shooter, Space, Character Customization, Choices Matter, Cinematic, Real-Time with Pause, Romance",Mature,BioWare,94.0,22,https://media.rawg.io/media/games/3cf/3cff89996570cf29a10eb9cd967dcf73.jpg
3017,Just Cause 3,2015-11-30,3.4,"Xbox One, PlayStation 4, PC","Action, Shooter","Singleplayer, Steam Achievements, Multiplayer, Full controller support, Atmospheric, steam-trading-cards, Great Soundtrack, RPG, Co-op, Open World, cooperative, Third Person, Funny, Exploration, Sandbox, Comedy, Third-Person Shooter, Moddable, Physics, Parkour, Destruction",Mature,"Square Enix, Avalanche Studios",74.0,7,https://media.rawg.io/media/games/5bb/5bb55ccb8205aadbb6a144cf6d8963f1.jpg
3604,Metro: Last Light Redux,2014-08-25,4.13,"Nintendo Switch, PC, Linux, Xbox One, PlayStation 4, macOS","Action, Shooter","Singleplayer, Steam Achievements, Multiplayer, Full controller support, Steam Cloud, Atmospheric, steam-trading-cards, Story Rich, Open World, First-Person, Sci-fi, Horror, FPS, Difficult, Survival, Stealth, Nudity, Survival Horror, Post-apocalyptic, overlay, Remake, Based On A Novel",,"Deep Silver, 4A Games, Fishlabs Entertainment",76.0,7,https://media.rawg.io/media/games/7a4/7a45e4cdc5b07f316d49cf147b083b27.jpg
3543,Borderlands: The Pre-Sequel,2014-10-13,3.56,"Linux, macOS, PC, PlayStation 3, Xbox 360, Android","Action, Shooter, RPG","Singleplayer, Steam Achievements, Multiplayer, Full controller support, Steam Cloud, Atmospheric, steam-trading-cards, RPG, Co-op, Open World, cooperative, First-Person, Sci-fi, FPS, Online Co-Op, Funny, Female Protagonist, Comedy, Action RPG, Space, Memes, Loot",,"Aspyr Media, 2K, Gearbox Software, 2K Australia",75.0,6,https://media.rawg.io/media/games/530/5302dd22a190e664531236ca724e8726.jpg
19301,Counter-Strike,2000-11-01,4.05,"macOS, PC, Linux, Xbox","Action, Shooter","Multiplayer, First-Person, FPS, Classic, Survival, Tactical, PvP, Team-Based, Military, Competitive, Valve Anti-Cheat enabled, 1990's, Assassin, 1980s, Ninja, Score Attack, e-sports",,"Valve Software, Turtle Rock Studios, Ritual Entertainment, Barking Dog Studios",88.0,3,https://media.rawg.io/media/games/9c4/9c47f320eb73c9a02d462e12f6206b26.jpg
13535,Left 4 Dead,2008-11-17,4.1,"PC, Xbox 360, macOS","Action, Shooter","Singleplayer, Steam Achievements, Multiplayer, Full controller support, Steam Cloud, Atmospheric, Co-op, cooperative, First-Person, Horror, FPS, Online Co-Op, Steam Leaderboards, Female Protagonist, Survival, Tactical, stats, Zombies, Moddable, Post-apocalyptic, Captions available, Replay Value, Team-Based, Competitive, Valve Anti-Cheat enabled, Commentary available, Includes Source SDK",Mature,"Valve Software, Turtle Rock Studios",89.0,5,https://media.rawg.io/media/games/476/476178ef18ab0534771d099f51cdc694.jpg
11142,BioShock 2 Remastered,2016-09-15,4.0,"PlayStation 4, macOS, PC, Xbox One, Nintendo Switch","Action, RPG","Singleplayer, Steam Achievements, Multiplayer, Full controller support, Steam Cloud, Atmospheric, RPG, Story Rich, First-Person, Sci-fi, Horror, FPS, Dystopian, Steampunk",Mature,"Digital Extremes, 2K Australia, 2K Marin, Virtuos, 2K China, Blind Squirrel",,4,https://media.rawg.io/media/games/7c4/7c448374df84b607f67ce9182a3a3ca7.jpg
3747,Metal Gear Solid V: Ground Zeroes,2014-03-18,3.9,"Xbox 360, PC, PlayStation 3, PlayStation 4, Xbox One","Action, Shooter","Singleplayer, Steam Achievements, Full controller support, Steam Cloud, Atmospheric, Great Soundtrack, Story Rich, Open World, Third Person, Steam Leaderboards, Classic, Sandbox, Comedy, Stealth, Tactical, Third-Person Shooter, Dark, Replay Value, Short, Cinematic, Cold War",,Kojima Productions,80.0,3,https://media.rawg.io/media/games/7ac/7aca7ccf0e70cd0974cb899ab9e5158e.jpg
3603,Metro 2033 Redux,2014-08-25,4.1,"PlayStation 4, Xbox One, Nintendo Switch, PC, macOS, Linux","Action, Shooter","Singleplayer, Steam Achievements, Multiplayer, Full controller support, Steam Cloud, Atmospheric, steam-trading-cards, Story Rich, Open World, First-Person, Horror, FPS, Gore, Classic, Survival, Stealth, Dark, Survival Horror, Post-apocalyptic, Mature, overlay, Remake, online, city, Based On A Novel, fire, light",Mature,"Deep Silver, 4A Games, Fishlabs Entertainment",88.0,6,https://media.rawg.io/media/games/4fb/4fb548e4816c84d1d70f1a228fb167cc.jpg
108,Mortal Kombat X,2015-04-07,3.86,"PC, Xbox One, PlayStation 4","Action, Fighting","Singleplayer, Steam Achievements, Multiplayer, Full controller support, Steam Cloud, Atmospheric, steam-trading-cards, Great Soundtrack, Third Person, Horror, Online Co-Op, Fantasy, Gore, Steam Leaderboards, Female Protagonist, Violent, Local Multiplayer, Mature, Competitive, Blood, 2.5D, 2D Fighter",Mature,"Warner Bros. Interactive, NetherRealm Studios, High Voltage Software",76.0,7,https://media.rawg.io/media/games/aa3/aa36ba4b486a03ddfaef274fb4f5afd4.jpg
4513,Just Cause 2,2010-03-23,3.61,"Xbox 360, PlayStation 3, Xbox One, PC","Action, Shooter","Singleplayer, Steam Achievements, Multiplayer, Full controller support, Steam Cloud, Atmospheric, Co-op, Open World, cooperative, Third Person, FPS, Funny, Exploration, Sandbox, Comedy, Third-Person Shooter, Moddable, Physics, 3D Vision, Destruction",Mature,"Square Enix, Avalanche Studios",84.0,3,https://media.rawg.io/media/games/a3c/a3c529a12c896c0ef02db5b4741de2ba.jpg
10141,NieR:Automata,2017-03-17,4.38,"PlayStation 4, Nintendo Switch, PC, Xbox One","Action, RPG","Singleplayer, Steam Achievements, Steam Cloud, Atmospheric, steam-trading-cards, Great Soundtrack, RPG, Story Rich, Open World, Sci-fi, Partial Controller Support, Female Protagonist, Violent, Anime, Nudity, Hack and Slash, Post-apocalyptic, JRPG, Robots, Bullet Hell, Character Action Game, Spectacle fighter",Mature,"Platinum Games, 8-4",86.0,13,https://media.rawg.io/media/games/5a4/5a44112251d70a25291cc33757220fce.jpg
326292,Fall Guys: Ultimate Knockout,2020-08-04,3.73,"Xbox One, PlayStation 4, PC, Nintendo Switch, Xbox Series S/X","Action, Sports, Casual, Massively Multiplayer, Indie","Steam Achievements, Full controller support, Online multiplayer, Cross-Platform Multiplayer",Everyone,Mediatonic,80.0,6,https://media.rawg.io/media/games/5eb/5eb49eb2fa0738fdb5bacea557b1bc57.jpg
274755,Hades,2020-09-17,4.44,"PlayStation 5, Xbox Series S/X, PlayStation 4, Nintendo Switch, PC, Xbox One","Action, Adventure, RPG, Indie","Singleplayer, Full controller support, Atmospheric, Great Soundtrack, RPG, Story Rich, 2D, Fantasy, Action-Adventure, Action RPG, Early Access, Hack and Slash, Replay Value, Roguelike, Isometric, Roguelite, Dungeon Crawler, Hand-drawn, Perma Death, dungeons",Teen,Supergiant Games,93.0,10,https://media.rawg.io/media/games/1f4/1f47a270b8f241e4676b14d39ec620f7.jpg
4166,Mass Effect,2007-11-16,4.39,"Xbox One, Xbox 360, PlayStation 3, PC","Action, RPG","Singleplayer, Atmospheric, Great Soundtrack, RPG, Story Rich, Open World, Third Person, Sci-fi, Female Protagonist, Action RPG, Third-Person Shooter, Space, Character Customization, Choices Matter, Dark Fantasy, Real-Time with Pause, Romance",Mature,"BioWare, Edge of Reality, Demiurge Studios",89.0,9,https://media.rawg.io/media/games/a6c/a6ccd34125c594abf1a9c9821b9a715d.jpg
46889,Monster Hunter: World,2018-01-26,4.01,"PlayStation 4, Xbox One, PC","Action, Adventure, RPG","Singleplayer, Multiplayer, Atmospheric, Great Soundtrack, RPG, Co-op, Open World, cooperative, Third Person, Partial Controller Support, Online Co-Op, Fantasy, Difficult, Exploration, Action-Adventure, Action RPG, stats, Hack and Slash, Character Customization, Replay Value, JRPG, 3rd-Person Perspective, Souls-like, Hunting, Dinosaurs, Monsters, atmosphere",Teen,"Capcom, Capcom U.S.A",89.0,15,https://media.rawg.io/media/games/21c/21cc15d233117c6809ec86870559e105.jpg
613,Bastion,2011-07-20,4.15,"PlayStation 4, PS Vita, Xbox One, PC, iOS, Linux, Nintendo Switch, Xbox 360, macOS","Action, Adventure, RPG, Indie","Singleplayer, Steam Achievements, Full controller support, Steam Cloud, Atmospheric, steam-trading-cards, Great Soundtrack, RPG, Story Rich, 2D, Fantasy, Steam Leaderboards, Action RPG, Controller, role-playing, Hack and Slash, Post-apocalyptic, controller support, Short, Colorful, Isometric, Music, Hand-drawn, Narration, Twin Stick Shooter, Dynamic Narration, Narrative",,"Warner Bros. Interactive, Supergiant Games",86.0,4,https://media.rawg.io/media/games/f99/f9979698c43fd84c3ab69280576dd3af.jpg
3191,Mad Max,2015-08-31,3.78,"PC, Xbox One, PlayStation 4, Xbox 360, Linux, macOS","Action, Adventure","Singleplayer, Multiplayer, Full controller support, Atmospheric, RPG, Open World, First-Person, Third Person, Exploration, Sandbox, Survival, Third-Person Shooter, War, Post-apocalyptic, Driving, movie-based",Mature,Avalanche Studios,73.0,11,https://media.rawg.io/media/games/d7d/d7d33daa1892e2468cd0263d5dfc957e.jpg
10989,Paladins,2016-09-15,3.08,"macOS, PC, PlayStation 4, Xbox One, Nintendo Switch","Action, Shooter","Steam Achievements, Multiplayer, steam-trading-cards, Co-op, cooperative, First-Person, Partial Controller Support, FPS, Online Co-Op, Fantasy, Funny, Survival, Free to Play, Online multiplayer, Early Access, PvP, Anime, In-App Purchases, Team-Based, Memes, MOBA",Teen,Hi-Rez Studios,78.0,6,https://media.rawg.io/media/games/d2c/d2c74dacd89fd817c2deb625b01adb1a.jpg
17576,Batman: Arkham City - Game of the Year Edition,2012-09-07,4.4,"PlayStation 4, Xbox 360, Xbox One, PlayStation 3, macOS, PC","Action, Adventure","Singleplayer, Steam Achievements, Steam Cloud, Atmospheric, steam-trading-cards, Story Rich, Open World, Third Person, Partial Controller Support, Sandbox, Stealth, Action-Adventure, Controller, Cinematic, Beat 'em up, Metroidvania, 3D Vision, Detective, Comic Book, Superhero, Batman",Teen,"Feral Interactive, Rocksteady Studios",91.0,9,https://media.rawg.io/media/games/c50/c5085506fe4b5e20fc7aa5ace842c20b.jpg
9810,ARK: Survival Evolved,2015-06-02,3.06,"Nintendo Switch, Xbox One, PlayStation 4, Linux, macOS, PC, iOS","Action, Adventure, RPG, Massively Multiplayer, Indie","Singleplayer, Steam Achievements, Multiplayer, Full controller support, Steam Cloud, RPG, Co-op, Open World, cooperative, First-Person, Sci-fi, Sandbox, Survival, Free to Play, Early Access, Steam Workshop, role-playing, Includes level editor, Crafting, Building, VR, Valve Anti-Cheat enabled, mmo, MMORPG, Base Building, Dragons, Dinosaurs",,"Instinct Games, Studio Wildcard, Efecto Studios, Virtual Basement, WILDCARD PROPERTIES",70.0,6,https://media.rawg.io/media/games/58a/58ac7f6569259dcc0b60b921869b19fc.jpg
25,Middle-earth: Shadow of War,2017-09-27,3.85,"PC, Xbox One, PlayStation 4, Android","Action, RPG","Singleplayer, Steam Achievements, Full controller support, Steam Cloud, Atmospheric, steam-trading-cards, Great Soundtrack, RPG, Story Rich, Open World, Third Person, Fantasy, Gore, Violent, Stealth, Action RPG, Anime, Hack and Slash, War, In-App Purchases, Dark Fantasy, Medieval, Magic",Mature,"Warner Bros. Interactive, Monolith Productions",82.0,13,https://media.rawg.io/media/games/21a/21ad672cedee9b4378abb6c2d2e626ee.jpg
22509,Minecraft,2009-05-10,4.43,"Android, PS Vita, PlayStation 4, PlayStation 3, Xbox 360, Nintendo 3DS, Nintendo Switch, macOS, PC, iOS, Wii U, Xbox One, Linux","Action, Simulation, Arcade, Massively Multiplayer, Indie","Multiplayer, Sandbox, 3D, Crafting, Building, vr mod, open-world, cube, modding, procedural-generation",Everyone 10+,"4J Studios, Mojang",83.0,26,https://media.rawg.io/media/games/b4e/b4e4c73d5aa4ec66bbf75375c4847a2b.jpg
10065,Cities: Skylines,2015-03-10,4.12,"Xbox One, PC, macOS, Linux, Nintendo Switch, PlayStation 4","Strategy, Simulation","Singleplayer, Steam Achievements, Steam Cloud, steam-trading-cards, Great Soundtrack, Partial Controller Support, Funny, Sandbox, Steam Workshop, Includes level editor, Moddable, Family Friendly, Replay Value, Realistic, Building, Management, Real-Time with Pause, Resource Management, Economy, City Builder, Mod, Modern",Everyone,Colossal Order,85.0,9,https://media.rawg.io/media/games/25c/25c4776ab5723d5d735d8bf617ca12d9.jpg
480,Resident Evil 7: Biohazard,2017-01-23,4.33,"macOS, PlayStation 4, PC, Xbox One, Nintendo Switch","Action, Shooter, Adventure","Singleplayer, Steam Achievements, Multiplayer, Full controller support, Steam Cloud, Atmospheric, steam-trading-cards, Story Rich, First-Person, Horror, FPS, Gore, Exploration, Classic, Survival, Violent, Action-Adventure, Zombies, Survival Horror, Cinematic, Memes, VR, Detective, America",Mature,"Capcom, Capcom U.S.A",85.0,10,https://media.rawg.io/media/games/cee/cee577e2097a59b77193fe2bce94667d.jpg
923,Titanfall 2,2016-10-28,4.31,"Xbox One, PlayStation 4, PC","Action, Shooter","Singleplayer, Steam Achievements, Multiplayer, Full controller support, Atmospheric, First-Person, Sci-fi, FPS, Gore, Exploration, Violent, Action-Adventure, PvP, Cinematic, combat, Team-Based, Futuristic, RTS, Fast-Paced, Military, Parkour, Online PvP, Steam Trading Cards, Robots, Time Travel, Mechs, Hero Shooter, grappling-hook",Mature,Respawn Entertainment,87.0,5,https://media.rawg.io/media/games/569/56978b5a77f13aa2ec5d09ec81d01cad.jpg
17572,Batman: Arkham Asylum Game of the Year Edition,2010-03-26,4.38,"PlayStation 3, PC, PlayStation 4, Xbox 360","Action, Adventure, Platformer","Singleplayer, Steam Achievements, Steam Cloud, Atmospheric, steam-trading-cards, Story Rich, Open World, Third Person, Partial Controller Support, Horror, Stealth, Action-Adventure, Controller, Beat 'em up, Metroidvania, 3D Vision, Detective, Comic Book, Superhero, Batman",,"Feral Interactive, Rocksteady Studios",91.0,8,https://media.rawg.io/media/games/fd8/fd882c8267a44621a0de6f9cec77ae90.jpg
9743,Unturned,2014-07-07,2.73,"PlayStation 4, Linux, macOS, PC, Xbox One","Action, Shooter","Singleplayer, Steam Achievements, Multiplayer, Steam Cloud, Atmospheric, steam-trading-cards, Co-op, Open World, cooperative, First-Person, Horror, FPS, Online Co-Op, Sandbox, Survival, Free to Play, Online multiplayer, stats, Early Access, Steam Workshop, Zombies, Includes level editor, In-App Purchases, Post-apocalyptic, Crafting, VR, Valve Anti-Cheat enabled",Teen,Smartly Dressed Games,,3,https://media.rawg.io/media/games/93e/93ee6101e1c943732f06080dddb0fe4c.jpg
