id,name,released,rating,platforms,genres,tags,esrb_rating,developers,metacritic,playtime,background_image
45969,Warhammer: Vermintide 2,2018-03-08,3.61,"Xbox One, PC, PlayStation 4","Action, Indie","Co-op, cooperative, Online Co-Op, Gore, Violent, Games Workshop",Mature,Fatshark,82.0,7,https://media.rawg.io/media/games/5be/5bec14622f6faf804a592176577c1347.jpg
13910,XCOM: Enemy Unknown,2012-10-09,4.2,"PC, Android, iOS, Xbox 360, PlayStation 3, macOS",Strategy,"Singleplayer, Steam Achievements, Multiplayer, Full controller support, Steam Cloud, Atmospheric, steam-trading-cards, Great Soundtrack, RPG, Sci-fi, Difficult, Tactical, Cross-Platform Multiplayer, Character Customization, Turn-Based, Replay Value, Futuristic, Isometric, Aliens, Turn-Based Strategy, Base Building, Turn-Based Tactics, Perma Death",,"Feral Interactive, 2K, Firaxis",89.0,13,https://media.rawg.io/media/games/238/2383a172b4d50a7b44e07980eb7141ea.jpg
13627,Undertale,2015-09-14,4.34,"Xbox Series S/X, Nintendo Switch, Xbox One, PC, macOS, Linux, PlayStation 4, PS Vita","RPG, Indie","Singleplayer, Great Soundtrack, RPG, Story Rich, 2D, Horror, Funny, Comedy, Pixel Graphics, Dark, Retro, role-playing, Cute, Replay Value, Choices Matter, Memes, Multiple Endings, overlay, Bullet Hell, Dating Sim",Everyone 10+,"8-4, Toby Fox",92.0,5,https://media.rawg.io/media/games/ffe/ffed87105b14f5beff72ff44a7793fd5.jpg
28179,SEGA Mega Drive and Genesis Classics,2010-06-01,2.98,"PlayStation 4, macOS, Linux, Xbox One, Nintendo Switch, PC","Action, Adventure, RPG, Fighting, Platformer","Singleplayer, Multiplayer, Full controller support, RPG, Co-op, cooperative, 2D, Local Co-Op, Steam Workshop, Retro, VR, Beat 'em up",Teen,"SEGA, d3t",76.0,2,https://media.rawg.io/media/games/0fd/0fd84d36596a83ef2e5a35f63a072218.jpg
5525,Brutal Legend,2009-10-12,3.65,"Xbox 360, PlayStation 3, Xbox One, iOS, PC, Linux, macOS","Action, Strategy","Singleplayer, Steam Achievements, Multiplayer, Full controller support, Steam Cloud, Atmospheric, steam-trading-cards, Great Soundtrack, RPG, Open World, Third Person, Fantasy, Funny, Comedy, Action-Adventure, Action RPG, Hack and Slash, controller support, RTS, Beat 'em up, Music, Gothic, Real time strategy",,"Electronic Arts, Double Fine Productions",80.0,5,https://media.rawg.io/media/games/af7/af7a831001c5c32c46e950cc883b8cb7.jpg
18240,Brothers: A Tale of Two Sons,2013-08-07,4.18,"PlayStation 3, Xbox One, iOS, Nintendo Switch, Xbox 360, PlayStation 4, Android, PC","Action, Adventure, Indie","Singleplayer, Steam Achievements, Multiplayer, Full controller support, Atmospheric, Great Soundtrack, Story Rich, 2D, Third Person, Fantasy, Survival, Local Co-Op, Controller, controller support, Short, Colorful, Turn-Based Strategy, Walking Simulator, Top-Down, 3D Vision, Linear, Stylized, Drama, Hand-drawn, Turn-Based Tactics, Lore-Rich, Puzzle Platformer, Grid-Based Movement, solitaire, Faith, Foreign, Sokoban",Teen,"Starbreeze Studios, Parables Games",90.0,3,https://media.rawg.io/media/games/b6b/b6b20bfc4b34e312dbc8aac53c95a348.jpg
1416,Mafia II,2010-08-24,4.24,"PlayStation 3, Xbox 360, PC, Xbox One","Action, Shooter","Singleplayer, Steam Achievements, Multiplayer, Atmospheric, Great Soundtrack, RPG, Story Rich, Open World, Third Person, Partial Controller Support, Classic, Sandbox, Third-Person Shooter, Nudity, Crime, 3D Vision, Driving, Music, America",Mature,2K Czech,77.0,13,https://media.rawg.io/media/games/9e5/9e5b274c7e3aa5e30beba31b834b0e7e.jpg
23585,Far Cry 5,2018-03-27,3.72,"PlayStation 4, PC, Xbox One","Action, Shooter","Singleplayer, Multiplayer, Atmospheric, steam-trading-cards, Co-op, Story Rich, Open World, cooperative, First-Person, Partial Controller Support, FPS, Exploration, Female Protagonist, Survival, Stealth, Includes level editor, Character Customization, Captions available, Memes, Illuminati, America, Hunting, microtransactions",Mature,"Ubisoft, Ubisoft Montreal, Ubisoft Toronto, Ubisoft Shanghai, Ubisoft Kiev, Red Storm",80.0,19,https://media.rawg.io/media/games/bce/bce62fbc7cf74bf6a1a37340993ec148.jpg
2361,Psychonauts,2005-04-01,4.04,"PlayStation 3, Xbox One, iOS, PC, macOS, Linux, Xbox 360, PlayStation 2, PlayStation 4, Xbox","Action, Platformer","Singleplayer, Steam Achievements, Steam Cloud, steam-trading-cards, Great Soundtrack, Story Rich, Third Person, Partial Controller Support, Funny, Exploration, Classic, Comedy, Action-Adventure, Cute, 3D, 3D Vision, Surreal, 3D Platformer, Cartoony, Cult Classic, Psychological",Teen,Double Fine Productions,87.0,4,https://media.rawg.io/media/games/c89/c89ca70716080733d03724277df2c6c7.jpg
51329,Shadow of the Tomb Raider,2018-09-14,3.91,"Xbox One, PC, PlayStation 4, macOS, Linux","Action, Adventure","Singleplayer, Steam Achievements, Full controller support, Steam Cloud, Atmospheric, steam-trading-cards, Great Soundtrack, Story Rich, Open World, Third Person, Gore, Exploration, Female Protagonist, Survival, Violent, Stealth, Action-Adventure, Dark, Lara Croft",Mature,Eidos Montreal,78.0,10,https://media.rawg.io/media/games/7f6/7f6cd70ba2ad57053b4847c13569f2d8.jpg
3687,Watch Dogs,2014-05-27,3.59,"Xbox One, Wii U, Xbox 360, PlayStation 3, PlayStation 4, PC","Action, Adventure","Singleplayer, Multiplayer, Atmospheric, RPG, Co-op, Open World, cooperative, Third Person, Partial Controller Support, FPS, Sandbox, Stealth, Third-Person Shooter, Futuristic, Parkour, Driving, Hacking, first person mod",Mature,"Ubisoft, Ubisoft Montreal",77.0,16,https://media.rawg.io/media/games/879/879c930f9c6787c920153fa2df452eb3.jpg
9830,Brawlhalla,2014-04-30,3.22,"Xbox One, Android, iOS, PC, macOS, Nintendo Switch, PlayStation 4","Action, Casual, Fighting, Indie","Singleplayer, Multiplayer, Full controller support, steam-trading-cards, Co-op, cooperative, 2D, Online Co-Op, Survival, Free to Play, Online multiplayer, Split Screen, Local Co-Op, Controller, Local Multiplayer, Early Access, Cross-Platform Multiplayer, Beat 'em up, 4 Player Local, 2D Fighter",Everyone 10+,"Ubisoft, Blue Mammoth Games",,2,https://media.rawg.io/media/games/35b/35b47c4d85cd6e08f3e2ca43ea5ce7bb.jpg
28201,Metro Exodus,2019-02-13,4.16,"PC, PlayStation 5, Xbox One, PlayStation 4","Action, Shooter","Singleplayer, Steam Achievements, Full controller support, Steam Cloud, Atmospheric, steam-trading-cards, Great Soundtrack, Story Rich, First-Person, Sci-fi, Horror, FPS, Gore, Exploration, Survival, Violent, Stealth, Survival Horror, Post-apocalyptic, Crafting, Cinematic, steam, meat, category, russia",Mature,4A Games,81.0,6,https://media.rawg.io/media/games/152/152e788b7504aa2753c86dae912fb34c.jpg
1450,INSIDE,2016-06-28,4.39,"Nintendo Switch, PC, iOS, macOS, Xbox One, PlayStation 4","Action, Adventure, Indie, Puzzle, Platformer","Singleplayer, Steam Achievements, Full controller support, Steam Cloud, Atmospheric, Great Soundtrack, Story Rich, Sci-fi, Horror, Stealth, Dark, controller support, Mystery, Short, Dystopian, achievements, Puzzle-Platformer, 2.5D, european, Oyun Kumandası Desteği, Steam Başarımları, Tek Oyunculu",Teen,Playdead,87.0,4,https://media.rawg.io/media/games/d5a/d5a24f9f71315427fa6e966fdd98dfa6.jpg
3931,Saints Row IV,2013-08-20,3.82,"PlayStation 3, PC, Xbox One, PlayStation 4, Xbox 360, Linux","Action, Adventure","Singleplayer, Multiplayer, Full controller support, Steam Cloud, Great Soundtrack, Co-op, Open World, cooperative, Third Person, Sci-fi, Online Co-Op, Funny, Sandbox, Female Protagonist, Comedy, Third-Person Shooter, Character Customization, Aliens, Dark Humor, Superhero, first person mod, Parody",Mature,Volition,86.0,13,https://media.rawg.io/media/games/e3d/e3ddc524c6292a435d01d97cc5f42ea7.jpg
4280,Max Payne 3,2012-05-15,4.26,"PlayStation 3, PC, Xbox 360, macOS","Action, Shooter","Singleplayer, Steam Achievements, Multiplayer, Atmospheric, Great Soundtrack, Co-op, Story Rich, Open World, Third Person, Partial Controller Support, FPS, Violent, Third-Person Shooter, Dark, Nudity, Cinematic, 3D Vision, Linear, Noir, Bullet Time",Mature,Rockstar Games,87.0,10,https://media.rawg.io/media/games/5bf/5bf88a28de96321c86561a65ee48e6c2.jpg
8488,Tom Clancy's Rainbow Six Siege,2015-12-01,3.89,"Xbox One, PC, PlayStation 4, Xbox Series S/X, PlayStation 5","Action, Shooter","Singleplayer, Multiplayer, Atmospheric, steam-trading-cards, Co-op, First-Person, Partial Controller Support, FPS, Online Co-Op, Female Protagonist, Tactical, Realistic, Physics, Team-Based, Competitive, Destruction",Teen,"Ubisoft, Ubisoft Montreal, Sperasoft",75.0,32,https://media.rawg.io/media/games/b34/b3419c2706f8f8dbe40d08e23642ad06.jpg
50734,Sekiro: Shadows Die Twice,2019-03-22,4.38,"Xbox One, PC, PlayStation 4","Action, RPG","Singleplayer, Atmospheric, Great Soundtrack, RPG, Story Rich, Open World, Third Person, Partial Controller Support, Difficult, Exploration, Violent, Stealth, Action-Adventure, Action RPG, Nudity, Dark Fantasy, Memes, Sexual Content, JRPG, 3rd-Person Perspective, Assassin, Souls-like, Ninja",Mature,FromSoftware,90.0,16,https://media.rawg.io/media/games/67f/67f62d1f062a6164f57575e0604ee9f6.jpg
2819,Firewatch,2016-02-08,4.3,"macOS, Linux, Nintendo Switch, PlayStation 4, Xbox One, PC","Adventure, Indie","Atmospheric, Great Soundtrack, Story Rich, Horror, Exploration, Mystery, Short, Colorful, Mature, Walking Simulator, Visual Novel, Drama, Interactive Fiction, Thriller, interactive movie, interactive game",Mature,Campo Santo,81.0,5,https://media.rawg.io/media/games/0be/0bea0a08a4d954337305391b778a7f37.jpg
2093,No Man's Sky,2016-08-09,3.7,"Nintendo Switch, Xbox One, PC, PlayStation 4, PlayStation 5","Action, Adventure, RPG, Simulation, Massively Multiplayer, Indie","Singleplayer, Steam Achievements, Multiplayer, Full controller support, Steam Cloud, Atmospheric, Great Soundtrack, Open World, First-Person, Sci-fi, Horror, FPS, Exploration, Sandbox, Survival, Space, controller support, Mystery, Crafting, overlay, online, achievements, Procedural Generation, Illuminati, console, Epic, nature, offline, Science, fight, weapons, cloud saves, Space Sim, journey, ship, planets, galaxy, light, sun, sky",Teen,Hello Games,75.0,15,https://media.rawg.io/media/games/174/1743b3dd185bda4a7be349347d4064df.jpg
3556,Alien: Isolation,2014-10-05,4.2,"PC, Xbox One, Nintendo Switch, Android, iOS, PlayStation 4","Action, Adventure","Singleplayer, Steam Achievements, Full controller support, Steam Cloud, Atmospheric, Great Soundtrack, First-Person, Sci-fi, Horror, FPS, Gore, Difficult, Female Protagonist, Survival, Stealth, Space, Survival Horror, Aliens, vr mod",Mature,"Feral Interactive, SEGA, Creative Assembly",81.0,4,https://media.rawg.io/media/games/daa/daaee07fcb40744d90cf8142f94a241f.jpg
4223,The Darkness II,2012-02-07,3.7,"PlayStation 3, macOS, PC, Xbox 360, Xbox One",Action,"Singleplayer, Steam Achievements, Multiplayer, Atmospheric, Co-op, Story Rich, cooperative, First-Person, Partial Controller Support, Horror, FPS, Funny, Gore, Violent, Dark, Nudity, Short, Multiple Endings, Comic Book, Supernatural",Mature,"2K, Digital Extremes",77.0,3,https://media.rawg.io/media/games/744/744adc36e6573dd67a0cb0e373738d19.jpg
58616,Assassin's Creed Odyssey,2018-10-05,3.98,"PlayStation 4, PC, Xbox One, Nintendo Switch","Action, RPG","Singleplayer, Atmospheric, steam-trading-cards, RPG, Story Rich, Open World, Third Person, Partial Controller Support, Female Protagonist, Stealth, In-App Purchases, Captions available, Historical, Parkour, Assassin",Mature,"Ubisoft, Ubisoft Montreal, Ubisoft Montpellier, Ubisoft Shanghai, Ubisoft Quebec, Ubisoft Bucharest, Ubisoft Singapore, Ubisoft Kiev",85.0,31,https://media.rawg.io/media/games/c6b/c6bd26767c1053fef2b10bb852943559.jpg
3678,War Thunder,2013-08-15,3.19,"Xbox One, PC, macOS, Linux, PlayStation 4","Action, Shooter, Massively Multiplayer","Singleplayer, Steam Achievements, Multiplayer, Co-op, Open World, cooperative, Partial Controller Support, FPS, Free to Play, Cross-Platform Multiplayer, War, In-App Purchases, Realistic, Historical, Team-Based, Military, mmo, World War II, Tanks, Flight, TrackIR",Teen,Gaijin Entertainment,81.0,6,https://media.rawg.io/media/games/d07/d0790809a13027251b6d0f4dc7538c58.jpg
58654,Hitman 2,2018-11-13,4.04,"Xbox One, PC, PlayStation 4","Action, Shooter","Singleplayer, Multiplayer, Great Soundtrack, Co-op, Open World, cooperative, Third Person, Gore, Sandbox, Violent, Stealth, Nudity, 3rd-Person Perspective, Assassin",Mature,IO Interactive,83.0,5,https://media.rawg.io/media/games/858/858c016de0cf7bc21a57dcc698a04a0c.jpg
4502,Darksiders,2010-01-27,3.76,"PlayStation 3, Xbox One, Xbox 360, Nintendo Switch, PC",Action,"Singleplayer, Steam Achievements, Steam Cloud, RPG, Open World, Third Person, Partial Controller Support, Fantasy, Gore, Action-Adventure, Action RPG, Controller, Hack and Slash, Post-apocalyptic, Beat 'em up, Metroidvania, 3D Platformer, Character Action Game, Spectacle fighter",Mature,"THQ, Vigil Games",83.0,3,https://media.rawg.io/media/games/8d4/8d46786ca86b1d95f3dc7e700e2dc4dd.jpg
28154,Cuphead,2017-09-29,4.37,"PlayStation 4, Nintendo Switch, Xbox One, macOS, PC","Action, Indie, Platformer","Singleplayer, Steam Achievements, Full controller support, Steam Cloud, Great Soundtrack, Co-op, cooperative, 2D, Funny, Difficult, Local Co-Op, Retro, Captions available, Colorful, Side Scroller, Shoot 'Em Up, Hand-drawn, Cartoony, Bullet Hell, Cartoon",,Studio MDHR,87.0,6,https://media.rawg.io/media/games/226/2262cea0b385db6cf399f4be831603b0.jpg
2235,Batman: Arkham Origins,2013-10-25,3.95,"PlayStation 3, PC, Android, Xbox 360",Action,"Singleplayer, Steam Achievements, Multiplayer, Full controller support, Steam Cloud, Atmospheric, steam-trading-cards, Story Rich, Open World, Third Person, Steam Leaderboards, Sandbox, Stealth, Action-Adventure, Controller, Third-Person Shooter, Beat 'em up, 3D Vision, Detective, Comic Book, Superhero, Batman",Teen,"Warner Bros. Interactive, Splash Damage",74.0,12,https://media.rawg.io/media/games/fc3/fc30790a3b3c738d7a271b02c1e26dc2.jpg
28568,Assassin's Creed II,2009-11-17,4.42,"Xbox 360, PlayStation 3, Xbox One, PC, macOS, PlayStation 4",Action,"Assassin, hero, Swords",Mature,Ubisoft Montreal,89.0,14,https://media.rawg.io/media/games/1be/1bed7fae69d1004c09dfe1101d5a3a94.jpg
262382,Disco Elysium,2019-10-14,4.39,"PC, macOS, Xbox One, Nintendo Switch, PlayStation 4, Xbox Series S/X, PlayStation 5","Adventure, RPG, Indie","Singleplayer, RPG, Story Rich, role-playing, Isometric",Mature,ZA/UM,91.0,6,https://media.rawg.io/media/games/840/8408ad3811289a6a5830cae60fb0b62a.jpg
356714,Among Us,2018-07-25,3.84,"Android, Nintendo Switch, PC, iOS, PlayStation 4, PlayStation 5, Xbox One","Action, Simulation, Casual","Multiplayer, Co-op, cooperative, 2D, Online Co-Op, Online multiplayer, Local Co-Op, Local Multiplayer, Cross-Platform Multiplayer, Space, In-App Purchases, ship, Minigames, party-game, spaceship",Everyone 10+,Innersloth,82.0,5,https://media.rawg.io/media/games/e74/e74458058b35e01c1ae3feeb39a3f724.jpg
58751,Halo Infinite,2021-12-08,3.65,"Xbox One, PC, Xbox Series S/X","Action, Shooter, Adventure","Singleplayer, Multiplayer, Full controller support, Atmospheric, Great Soundtrack, Co-op, Story Rich, Open World, cooperative, First-Person, Sci-fi, FPS, Online Co-Op, Classic, Sandbox, Free to Play, Action-Adventure, PvP, Space, combat, Futuristic, Aliens, Sexual Content, Online PvP, battle, Lore-Rich, Epic, Beautiful, weapons, hero, balance, Endless, arena, tv, map, hd, Gaming",Teen,343 Industries,84.0,2,https://media.rawg.io/media/games/e1f/e1ffbeb1bac25b19749ad285ca29e158.jpg
58777,DOOM Eternal,2020-03-20,4.38,"PC, PlayStation 4, Xbox One, Nintendo Switch, PlayStation 5","Action, Shooter","Singleplayer, Multiplayer, Atmospheric, Great Soundtrack, Co-op, First-Person, Sci-fi, Partial Controller Support, Horror, FPS, Gore, Violent, Online multiplayer, Fast-Paced, Blood, Demons",Mature,"Bethesda Softworks, id Software, Bethesda Game Studios, Panic Button, Virtuos, Nerve Software",86.0,12,https://media.rawg.io/media/games/3ea/3ea3c9bbd940b6cb7f2139e42d3d443f.jpg
28153,Assassin's Creed Origins,2017-10-27,3.96,"Xbox One, PC, PlayStation 4","Action, RPG",,Mature,"Ubisoft, Ubisoft Montreal",81.0,28,https://media.rawg.io/media/games/336/336c6bd63d83cf8e59937ab8895d1240.jpg
326243,Elden Ring,2022-02-25,4.41,"PC, Xbox One, PlayStation 4, Xbox Series S/X, PlayStation 5","Action, RPG","Singleplayer, Steam Achievements, Multiplayer, Full controller support, Atmospheric, Great Soundtrack, RPG, Co-op, Open World, cooperative, Third Person, Online Co-Op, Fantasy, Difficult, Violent, Action RPG, PvP, 3D, Dark Fantasy, Online PvP, Steam Trading Cards, Epic, Souls-like, history",Mature,FromSoftware,95.0,62,https://media.rawg.io/media/games/b29/b294fdd866dcdb643e7bab370a552855.jpg
2792,Layers of Fear,2016-02-16,3.53,"PlayStation 4, Linux, macOS, PC, iOS, Xbox One","Adventure, Indie","Singleplayer, Steam Achievements, Full controller support, Steam Cloud, Atmospheric, steam-trading-cards, Great Soundtrack, Story Rich, First-Person, Partial Controller Support, Horror, Exploration, Dark, Point & Click, Survival Horror, Mystery, Short, Mature, Walking Simulator, Multiple Endings, Surreal, Emotional, Interactive Fiction, Supernatural, Lovecraftian, Psychedelic, Narrative, immersive",Mature,"Bloober Team, Anshar Studios",72.0,3,https://media.rawg.io/media/games/6a2/6a2e48933245e2cd3c92248c75c925e1.jpg
3876,Deus Ex: Human Revolution - Director's Cut,2013-10-22,4.3,"Wii U, PC, macOS, Xbox 360, PlayStation 3","Action, RPG","Singleplayer, Steam Achievements, Steam Cloud, Atmospheric, steam-trading-cards, Great Soundtrack, RPG, Story Rich, Open World, First-Person, Sci-fi, Partial Controller Support, FPS, Stealth, Action RPG, Captions available, Replay Value, combat, Futuristic, Cyberpunk, Dystopian, Story, Commentary available, character, Conspiracy, Hacking, weapons, Inventory Management, secrets, Transhumanism",Mature,"Feral Interactive, Eidos Montreal",91.0,6,https://media.rawg.io/media/games/a12/a12f806432cb385bc286f0935c49cd14.jpg
4003,GRID 2,2013-05-27,3.29,"PlayStation 3, Xbox 360, macOS, PC","Racing, Arcade","Singleplayer, Steam Achievements, Multiplayer, Full controller support, Steam Cloud, steam-trading-cards, Co-op, Open World, cooperative, First-Person, Steam Leaderboards, Split Screen, Local Co-Op, Controller, Local Multiplayer, Realistic, Valve Anti-Cheat enabled, 3D Vision, Driving",Everyone 10+,"Feral Interactive, Codemasters",80.0,3,https://media.rawg.io/media/games/27b/27b02ffaab6b250cc31bf43baca1fc34.jpg
1682,The Wolf Among Us,2013-10-10,4.39,"PS Vita, PlayStation 4, Xbox One, iOS, PC, Android, Xbox 360, macOS",Adventure,"Singleplayer, Full controller support, Atmospheric, Great Soundtrack, Story Rich, Fantasy, Dark, Point & Click, Nudity, controller support, Mystery, Mature, Cinematic, Detective, Cartoony, Episodic, Comic Book, Choose Your Own Adventure, Quick-Time Events, Noir",Mature,Telltale Games,82.0,9,https://media.rawg.io/media/games/be0/be084b850302abe81675bc4ffc08a0d0.jpg
998,Battlefield 1,2016-10-21,3.83,"Xbox One, PC, PlayStation 4","Action, Shooter","Singleplayer, Steam Achievements, Multiplayer, Full controller support, Atmospheric, Great Soundtrack, Open World, First-Person, FPS, Gore, Violent, PvP, War, Mature, Physics, Historical, Military, Online PvP, Story, Steam Trading Cards, battle, Destruction, Tanks, history, Classes, World War I, tank, ww1",,"Electronic Arts, Electronic Arts DICE",88.0,6,https://media.rawg.io/media/games/998/9980c4296f311d8bcc5b451ca51e4fe1.jpg
13461,Resident Evil 5,2009-03-03,3.82,"Xbox One, Xbox 360, PC, Nintendo Switch, PlayStation 3, PlayStation 4","Action, Shooter","Singleplayer, Multiplayer, cooperative, Online Co-Op, Third-Person Shooter, Zombies, Survival Horror",Mature,"Capcom, Capcom U.S.A, Mercenary Technology",86.0,11,https://media.rawg.io/media/games/974/974342a3959981a17bdbbff2fd7f97b0.jpg
3497,Far Cry 4,2014-11-18,3.82,"PlayStation 4, PlayStation 3, PC, Xbox One, Xbox 360",Shooter,"Singleplayer, Multiplayer, Atmospheric, RPG, Co-op, Story Rich, Open World, cooperative, First-Person, Partial Controller Support, FPS, Online Co-Op, Exploration, Sandbox, Survival, Stealth, Action RPG, Crafting, Hunting",Mature,"Ubisoft, Ubisoft Montreal",80.0,17,https://media.rawg.io/media/games/b39/b396dac1f3e0f538841aa0355dd066d3.jpg
17959,Ori and the Blind Forest: Definitive Edition,2016-04-27,4.42,"Xbox One, PC, Nintendo Switch, Xbox 360","Adventure, Platformer","Singleplayer, Steam Achievements, Full controller support, Steam Cloud, Atmospheric, Great Soundtrack, RPG, Story Rich, Open World, 2D, Fantasy, Difficult, Controller, stats, Family Friendly, Cute, Side Scroller, Metroidvania, 2.5D",Everyone,Moon Studios,88.0,6,https://media.rawg.io/media/games/04a/04a7e7e185fb51493bdcbe1693a8b3dc.jpg
22571,Black Desert Online,2014-12-01,2.91,"Xbox One, PC, PlayStation 4","Action, Adventure, RPG, Strategy, Simulation, Massively Multiplayer","Multiplayer, RPG, Co-op, Open World, Fantasy, Female Protagonist, Online multiplayer, PvP, Anime, In-App Purchases, mmo, MMORPG",Teen,Pearl Abyss,73.0,4,https://media.rawg.io/media/games/651/651ae84f2d5e36206aad90976a453329.jpg
4599,Saints Row 2,2008-10-14,3.56,"PlayStation 3, Xbox 360, PC, Linux, Xbox One","Action, Shooter","Singleplayer, Multiplayer, Steam Cloud, Great Soundtrack, Co-op, Open World, cooperative, Third Person, Online Co-Op, Funny, Sandbox, Female Protagonist, Comedy, Third-Person Shooter, Moddable, Character Customization, Replay Value, Crime, overlay, Co-op Campaign",Mature,"Volition, THQ",78.0,2,https://media.rawg.io/media/games/10d/10d19e52e5e8415d16a4d344fe711874.jpg
4527,Call of Duty: Modern Warfare 2,2009-11-10,4.27,"PC, Xbox One, PlayStation 3, macOS, Xbox 360",Shooter,"Singleplayer, Steam Achievements, Multiplayer, Steam Cloud, Atmospheric, Great Soundtrack, Co-op, Story Rich, cooperative, First-Person, FPS, Online Co-Op, Tactical, PvP, Zombies, Moddable, War, Military, Valve Anti-Cheat enabled, Linear",Mature,Infinity Ward,86.0,22,https://media.rawg.io/media/games/9af/9af24c1886e2c7b52a4a2c65aa874638.jpg
10297,Sid Meier’s Civilization VI,2016-10-20,4.16,"iOS, PC, macOS, PlayStation 4, Xbox One, Nintendo Switch, Linux","Strategy, Simulation","Singleplayer, Steam Achievements, Multiplayer, steam-trading-cards, Great Soundtrack, Co-op, Open World, Online Co-Op, Tactical, Steam Workshop, Moddable, War, Turn-Based, Historical, Memes, Turn-Based Strategy, Cartoony, Cartoon, Grand Strategy, 4X",Everyone 10+,"Aspyr Media, Firaxis",88.0,15,https://media.rawg.io/media/games/997/997ab4d67e96fb20a4092383477d4463.jpg
19590,Ori and the Blind Forest,2015-03-10,4.38,"Xbox 360, Xbox One, PC","Adventure, Platformer","Singleplayer, Steam Achievements, Full controller support, Steam Cloud, Atmospheric, steam-trading-cards, Great Soundtrack, RPG, Story Rich, Open World, 2D, Fantasy, Difficult, Exploration, stats, Family Friendly, Cute, Side Scroller, Metroidvania, 2.5D",Everyone,Moon Studios,88.0,6,https://media.rawg.io/media/games/f8c/f8c6a262ead4c16b47e1219310210eb3.jpg
3168,SOMA,2015-09-21,4.16,"PlayStation 4, Xbox One, PC, macOS, Linux","Action, Adventure, Indie","Singleplayer, Steam Achievements, Full controller support, Steam Cloud, Atmospheric, steam-trading-cards, Great Soundtrack, Story Rich, First-Person, Sci-fi, Horror, Gore, Survival, Stealth, Steam Workshop, Moddable, Survival Horror, Walking Simulator, Robots, Underwater",Mature,Frictional Games,84.0,6,https://media.rawg.io/media/games/149/149bbed9d90dc09328ba79bbacfda3c8.jpg
13305,Assassin’s Creed III,2012-10-30,3.74,"Wii U, Xbox 360, PlayStation 3, Xbox One, PlayStation 4, PC",Action,"Singleplayer, Multiplayer, Atmospheric, Story Rich, Open World, Third Person, Partial Controller Support, Sandbox, Stealth, Action-Adventure, Controller, Historical, Parkour, Assassin, America, Alternate History, Conspiracy, Hunting",Mature,Ubisoft Montreal,80.0,22,https://media.rawg.io/media/games/275/2759da6fcaa8f81f21800926168c85f6.jpg
28172,Kingdom Come: Deliverance,2018-02-13,4.04,"PlayStation 4, Xbox One, PC","Action, Adventure, RPG","Singleplayer, Steam Achievements, Full controller support, Atmospheric, Great Soundtrack, RPG, Story Rich, Open World, First-Person, Choices Matter, Realistic, Historical, Medieval, Kickstarter, Choose Your Own Adventure, CRPG, Swordplay, Crowdfunded, Horses, Einzelspieler, Steam-Errungenschaften, Volle Controllerunterstützung",Mature,"Deep Silver, Warhorse Studios",71.0,10,https://media.rawg.io/media/games/d8f/d8f3b28fc747ed6f92943cdd33fb91b5.jpeg
4013,Call of Juarez: Gunslinger,2013-05-14,3.81,"PlayStation 3, PC, Nintendo Switch, Xbox 360, Xbox One","Action, Shooter","Singleplayer, Steam Achievements, Full controller support, Steam Cloud, Atmospheric, steam-trading-cards, Great Soundtrack, Story Rich, First-Person, FPS, Funny, Gore, Steam Leaderboards, Comedy, Historical, Linear, Narration, Alternate History, Western, Bullet Time, Dynamic Narration",,"Ubisoft, Techland",79.0,5,https://media.rawg.io/media/games/a86/a86ce0afaf2d5ec2b0f048989f01795e.jpg
3766,Thief,2014-02-25,3.26,"PlayStation 4, PlayStation 3, Xbox 360, Xbox One, macOS, PC","Action, Adventure","Singleplayer, Steam Achievements, Full controller support, Steam Cloud, Atmospheric, steam-trading-cards, RPG, Open World, First-Person, Horror, FPS, Fantasy, Steam Leaderboards, Stealth, Dark, Nudity, Medieval, Parkour, 3D Vision, Steampunk, Assassin, Heist",Mature,"Feral Interactive, Square Enix, Eidos Montreal",70.0,5,https://media.rawg.io/media/games/59a/59a3ebcba3d08c51532c6ca877aff256.jpg
10061,Watch Dogs 2,2016-11-28,3.84,"Xbox One, PlayStation 4, PC","Action, Adventure","Singleplayer, Multiplayer, Atmospheric, Co-op, Open World, cooperative, Third Person, Partial Controller Support, Gore, Comedy, Stealth, Third-Person Shooter, Cute, Mature, Parkour, Sexual Content, Crime, Illuminati, Hacking, first person mod",Mature,Ubisoft Montreal,79.0,17,https://media.rawg.io/media/games/f52/f52cf6ba08089cd5f1a9c8f7fcc93d1f.jpg
