id,name,released,rating,platforms,genres,tags,esrb_rating,developers,metacritic,playtime,background_image
3498,Grand Theft Auto V,2013-09-17,4.47,"PC, PlayStation 5, Xbox Series S/X, PlayStation 4, PlayStation 3, Xbox 360, Xbox One",Action,"Singleplayer, Steam Achievements, Multiplayer, Full controller support, Atmospheric, Great Soundtrack, RPG, Co-op, Open World, cooperative, First-Person, Third Person, Funny, Sandbox, Comedy, Third-Person Shooter, Moddable, Crime, vr mod",Mature,"Rockstar North, Rockstar Games",92.0,74,https://media.rawg.io/media/games/20a/20aa03a10cda45239fe22d035c0ebe64.jpg
3328,The Witcher 3: Wild Hunt,2015-05-18,4.65,"Xbox Series S/X, PlayStation 5, macOS, PlayStation 4, Nintendo Switch, PC, Xbox One","Action, RPG","Singleplayer, Full controller support, Atmospheric, Great Soundtrack, RPG, Story Rich, Open World, Third Person, Fantasy, Sandbox, Action RPG, Dark, Nudity, controller support, Choices Matter, Dark Fantasy, Mature, Medieval, Magic, Multiple Endings",Mature,CD PROJEKT RED,92.0,43,https://media.rawg.io/media/games/618/618c2031a07bbff6b4f611f10b6bcdbc.jpg
4200,Portal 2,2011-04-18,4.59,"PlayStation 3, PC, Xbox 360, Linux, macOS, Xbox One","Shooter, Puzzle","Singleplayer, Steam Achievements, Multiplayer, Full controller support, Steam Cloud, Atmospheric, steam-trading-cards, Co-op, Story Rich, cooperative, First-Person, Sci-fi, FPS, Online Co-Op, Funny, Female Protagonist, Comedy, Local Co-Op, stats, Steam Workshop, Space, Includes level editor, Captions available, Commentary available, Science",Everyone 10+,Valve Software,95.0,11,https://media.rawg.io/media/games/2ba/2bac0e87cf45e5b508f227d281c9252a.jpg
4291,Counter-Strike: Global Offensive,2012-08-21,3.56,"PC, Linux, Xbox 360, PlayStation 3",Shooter,"Steam Achievements, Multiplayer, Full controller support, steam-trading-cards, Co-op, cooperative, First-Person, FPS, Online Co-Op, Tactical, stats, Steam Workshop, PvP, Moddable, War, In-App Purchases, Realistic, Team-Based, Fast-Paced, Military, Competitive, Valve Anti-Cheat enabled, e-sports, Trading",Mature,"Valve Software, Hidden Path Entertainment",81.0,64,https://media.rawg.io/media/games/736/73619bd336c894d6941d926bfd563946.jpg
5286,Tomb Raider (2013),2013-03-05,4.06,"PlayStation 3, Xbox 360, macOS, PC, Xbox One, PlayStation 4",Action,"Singleplayer, Multiplayer, Full controller support, Atmospheric, RPG, Third Person, Exploration, Classic, Female Protagonist, Stealth, Action-Adventure, Third-Person Shooter, Retro, Cinematic, Quick-Time Events, Dinosaurs, Lara Croft",Mature,Crystal Dynamics,86.0,10,https://media.rawg.io/media/games/021/021c4e21a1824d2526f925eff6324653.jpg
13536,Portal,2007-10-09,4.49,"macOS, PC, Android, PlayStation 3, Xbox 360, Linux, Nintendo Switch","Action, Puzzle","Singleplayer, Steam Achievements, Atmospheric, Great Soundtrack, Story Rich, First-Person, Sci-fi, Partial Controller Support, FPS, Funny, Classic, Female Protagonist, Comedy, Includes level editor, Captions available, Short, Physics, Dark Humor, Commentary available, Includes Source SDK, Science",Teen,"Valve Software, NVIDIA Lightspeed Studios",90.0,4,https://media.rawg.io/media/games/7fa/7fa0b586293c5861ee32490e953a4996.jpg
12020,Left 4 Dead 2,2009-11-17,4.09,"Xbox 360, Linux, PC, macOS","Action, Shooter","Singleplayer, Steam Achievements, Multiplayer, Full controller support, Steam Cloud, steam-trading-cards, Co-op, cooperative, First-Person, Horror, FPS, Online Co-Op, Gore, Survival, Local Co-Op, Tactical, stats, Steam Workshop, Zombies, Moddable, Survival Horror, Post-apocalyptic, Captions available, Replay Value, Team-Based, Valve Anti-Cheat enabled, Commentary available, Includes Source SDK",Mature,"Valve Software, Turtle Rock Studios",89.0,9,https://media.rawg.io/media/games/d58/d588947d4286e7b5e0e12e1bea7d9844.jpg
5679,The Elder Scrolls V: Skyrim,2011-11-11,4.42,"PC, Xbox Series S/X, PlayStation 5, Xbox One, PlayStation 4, Nintendo Switch, Xbox 360, PlayStation 3","Action, RPG","Singleplayer, Steam Achievements, Steam Cloud, Atmospheric, steam-trading-cards, Great Soundtrack, RPG, Story Rich, Open World, First-Person, Third Person, Partial Controller Support, Fantasy, Sandbox, Action RPG, Steam Workshop, role-playing, Moddable, Character Customization, Dark Fantasy, Medieval, Magic, Lore-Rich, Dragons",Mature,Bethesda Game Studios,94.0,46,https://media.rawg.io/media/games/7cf/7cfc9220b401b7a300e409e539c9afd5.jpg
28,Red Dead Redemption 2,2018-10-26,4.59,"PC, PlayStation 4, Xbox One",Action,"Singleplayer, Multiplayer, Atmospheric, Great Soundtrack, Co-op, Story Rich, Open World, First-Person, Third Person, Partial Controller Support, FPS, Online Co-Op, Gore, Exploration, Sandbox, Violent, Third-Person Shooter, PvP, In-App Purchases, Mature, Realistic, Historical, Cinematic, Crime, Online PvP, 3rd-Person Perspective, Blood, America, Masterpiece, Beautiful, Hunting, Western, 3rd-person",Mature,Rockstar Games,96.0,21,https://media.rawg.io/media/games/511/5118aff5091cb3efec399c808f8c598f.jpg
4062,BioShock Infinite,2013-03-26,4.38,"PlayStation 4, Xbox 360, Nintendo Switch, Linux, PC, PlayStation 3, Xbox One","Action, Shooter","Singleplayer, Steam Achievements, Full controller support, Steam Cloud, Atmospheric, steam-trading-cards, Great Soundtrack, RPG, Story Rich, First-Person, Sci-fi, FPS, Fantasy, Gore, Controller, Dystopian, Linear, Steampunk, Alternate History, Time Travel, Political",Mature,"Aspyr Media, 2K Australia, Irrational Games",94.0,12,https://media.rawg.io/media/games/fc1/fc1307a2774506b5bd65d7e8424664a7.jpg
13537,Half-Life 2,2004-11-16,4.48,"PC, macOS, Xbox 360, Linux, Xbox, Android","Action, Shooter","Singleplayer, Steam Achievements, Multiplayer, Steam Cloud, Atmospheric, steam-trading-cards, Great Soundtrack, Story Rich, First-Person, Sci-fi, Partial Controller Support, Horror, FPS, Classic, Zombies, Moddable, Captions available, Physics, Aliens, Dystopian, Includes Source SDK, Silent Protagonist, vr mod",Mature,"Valve Software, NVIDIA Lightspeed Studios",96.0,7,https://media.rawg.io/media/games/b8c/b8c243eaa0fbac8115e0cdccac3f91dc.jpg
802,Borderlands 2,2012-09-18,4.01,"PlayStation 3, macOS, PC, Android, Linux, PS Vita, Xbox 360","Action, Shooter, RPG","Singleplayer, Steam Achievements, Multiplayer, Full controller support, Steam Cloud, Atmospheric, steam-trading-cards, RPG, Co-op, Open World, cooperative, Sci-fi, FPS, Online Co-Op, Funny, Comedy, Action RPG, Futuristic, Memes, Stylized, Dark Humor, Loot",Mature,"Aspyr Media, 2K, Gearbox Software, Sony Computer Entertainment America",89.0,11,https://media.rawg.io/media/games/49c/49c3dfa4ce2f6f140cc4825868e858cb.jpg
3439,Life is Strange,2015-01-29,4.12,"iOS, PC, Linux, PlayStation 3, macOS, Xbox 360, Android, PlayStation 4, Xbox One",Adventure,"Singleplayer, Full controller support, Atmospheric, steam-trading-cards, Great Soundtrack, Story Rich, Third Person, Female Protagonist, Dark, Point & Click, Mystery, Short, Choices Matter, Memes, Walking Simulator, Multiple Endings, Story, Episodic, Soundtrack, Time Travel, Time Manipulation, student, strange, photography",Mature,DONTNOD Entertainment,83.0,6,https://media.rawg.io/media/games/562/562553814dd54e001a541e4ee83a591c.jpg
4286,BioShock,2007-08-21,4.36,"PlayStation 3, macOS, PC, Xbox 360","Action, Shooter","Singleplayer, Atmospheric, Great Soundtrack, RPG, Story Rich, First-Person, Sci-fi, Partial Controller Support, Horror, FPS, Classic, Action RPG, Dark, Dystopian, Steampunk, Alternate History, Political, Underwater",Mature,"Digital Extremes, 2K Australia, 2K Marin, Irrational Games, 2K China",96.0,3,https://media.rawg.io/media/games/bc0/bc06a29ceac58652b684deefe7d56099.jpg
32,Destiny 2,2017-09-06,3.52,"PlayStation 4, Xbox One, PC, Web, Xbox Series S/X, PlayStation 5","Action, Shooter","Singleplayer, Multiplayer, Full controller support, Atmospheric, Great Soundtrack, Co-op, Open World, cooperative, First-Person, Sci-fi, FPS, Online Co-Op, Exploration, Free to Play, Online multiplayer, Action-Adventure, PvP, Space, combat, Futuristic, Aliens, Story, 3rd-Person Perspective, online, MMORPG, PvE, Loot, Lore-Rich, city, friends, console, Masterpiece, weapons, skill, destroy, collect, hunt, gun, rain, enemy, quick, darkness, defender",Teen,Bungie,82.0,6,https://media.rawg.io/media/games/34b/34b1f1850a1c06fd971bc6ab3ac0ce0e.jpg
3939,PAYDAY 2,2013-08-13,3.52,"Linux, PC, Xbox One","Action, Shooter","Singleplayer, Steam Achievements, Multiplayer, Full controller support, steam-trading-cards, Great Soundtrack, Co-op, cooperative, First-Person, FPS, Online Co-Op, Funny, Stealth, Tactical, In-App Purchases, Team-Based, Crime, PvE, Heist, Gun Customization",Adults Only,"505 Games, OVERKILL Software",79.0,9,https://media.rawg.io/media/games/73e/73eecb8909e0c39fb246f457b5d6cbbe.jpg
3070,Fallout 4,2015-11-09,3.81,"PlayStation 4, PC, PlayStation 5, Xbox One","Action, RPG","Singleplayer, Steam Achievements, Full controller support, Steam Cloud, Atmospheric, Great Soundtrack, RPG, Story Rich, Open World, First-Person, Third Person, Sci-fi, FPS, Exploration, Sandbox, Survival, Action RPG, Third-Person Shooter, Post-apocalyptic",Mature,Bethesda Game Studios,84.0,38,https://media.rawg.io/media/games/d82/d82990b9c67ba0d2d09d4e6fa88885a7.jpg
1030,Limbo,2010-07-21,4.14,"PC, Android, PS Vita, PlayStation 4, PlayStation 3, Xbox 360, Linux, macOS, iOS, Xbox One, Nintendo Switch","Action, Adventure, Indie, Puzzle, Platformer","Singleplayer, Full controller support, Atmospheric, 2D, Horror, Difficult, Action-Adventure, Pixel Graphics, Controller, Dark, controller support, Short, Dark Fantasy, Physics, Side Scroller, Cinematic, combat, Linear, Surreal, Puzzle-Platformer, Minimalist, 2D Fighter, Noir, 2D Platformer, Family Sharing, 2D-платформер, 2D-файтинг",Teen,"Double Eleven, Playdead, 鱼俞",88.0,3,https://media.rawg.io/media/games/942/9424d6bb763dc38d9378b488603c87fa.jpg
2454,DOOM (2016),2016-05-13,4.38,"PlayStation 4, Nintendo Switch, PC, Xbox One","Action, Shooter","Singleplayer, Multiplayer, Atmospheric, Great Soundtrack, Co-op, cooperative, First-Person, Sci-fi, Partial Controller Support, Horror, FPS, Gore, Difficult, Classic, Zombies, Memes, Fast-Paced, Remake, Blood, Demons",Mature,"Bethesda Softworks, id Software, Panic Button, Tango Gameworks, Escalation Studios, Certain Affinity, Digital Domain, BattleCry Studios",85.0,10,https://media.rawg.io/media/games/587/587588c64afbff80e6f444eb2e46f9da.jpg
41494,Cyberpunk 2077,2020-12-10,4.2,"PlayStation 4, PC, Xbox Series S/X, PlayStation 5, Xbox One","Action, Shooter, RPG","Singleplayer, Atmospheric, Great Soundtrack, RPG, Story Rich, Open World, First-Person, Sci-fi, FPS, Exploration, Sandbox, Violent, Action-Adventure, Action RPG, role-playing, Nudity, Mature, Cinematic, Futuristic, Sexual Content, Cyberpunk, Crime, Robots, 3rd-Person Perspective, Blood, America, Masterpiece, Soundtrack, Hacking, Role Playing Game, immersive, Photorealistic",Mature,"CD PROJEKT RED, CD PROJEKT",73.0,29,https://media.rawg.io/media/games/26d/26d4437715bee60138dab4a7c8c59c92.jpg
422,Terraria,2011-05-16,4.06,"Xbox 360, Wii U, Nintendo 3DS, Xbox One, PlayStation 4, iOS, PC, macOS, Linux, Nintendo Switch, PlayStation 3, PS Vita, Android","Action, Indie, Platformer","Singleplayer, Steam Achievements, Multiplayer, Full controller support, Steam Cloud, Atmospheric, steam-trading-cards, RPG, Co-op, Open World, 2D, Online Co-Op, Exploration, Sandbox, Survival, Online multiplayer, Pixel Graphics, role-playing, Family Friendly, controller support, Replay Value, Crafting, Building, overlay",Teen,"Engine Software, Codeglue, Pipeworks Studio, Re-Logic",81.0,15,https://media.rawg.io/media/games/f46/f466571d536f2e3ea9e815ad17177501.jpg
766,Warframe,2013-03-25,3.42,"iOS, Xbox Series S/X, PlayStation 5, PlayStation 4, Xbox One, Nintendo Switch, PC","Action, Shooter, RPG, Massively Multiplayer","Singleplayer, Multiplayer, steam-trading-cards, RPG, Co-op, cooperative, Third Person, Sci-fi, Partial Controller Support, FPS, Online Co-Op, Free to Play, Third-Person Shooter, Space, role-playing, Hack and Slash, In-App Purchases, Futuristic, Parkour, Cyberpunk, PvE, Ninja, looter shooter",,"Digital Extremes, Panic Button",73.0,8,https://media.rawg.io/media/games/f87/f87457e8347484033cb34cde6101d08d.jpg
4459,Grand Theft Auto IV,2008-04-29,4.26,"Xbox 360, PC, PlayStation 3, Xbox One",Action,"Singleplayer, Multiplayer, Atmospheric, Co-op, Open World, cooperative, Third Person, Partial Controller Support, Funny, Gore, Classic, Sandbox, Third-Person Shooter, Moddable, Crime, Dark Humor, Satire, first person mod, Bowling",Mature,Rockstar North,95.0,10,https://media.rawg.io/media/games/4a0/4a0a1316102366260e6f38fd2a9cfdce.jpg
3272,Rocket League,2015-07-07,3.93,"Nintendo Switch, Linux, macOS, Xbox One, PC, PlayStation 4","Sports, Racing, Indie","Singleplayer, Steam Achievements, Multiplayer, Full controller support, Steam Cloud, steam-trading-cards, Great Soundtrack, Co-op, cooperative, Online Co-Op, Funny, Split Screen, Local Co-Op, Local Multiplayer, stats, Steam Workshop, Cross-Platform Multiplayer, Team-Based, Fast-Paced, Competitive, 4 Player Local, 4 giocatori divano, Football, Soccer, lan party",Everyone,Psyonix,86.0,21,https://media.rawg.io/media/games/8cc/8cce7c0e99dcc43d66c8efd42f9d03e3.jpg
29028,Metro 2033,2010-03-16,3.94,"Xbox 360, PC","Action, Shooter","Singleplayer, Steam Achievements, Full controller support, Steam Cloud, Atmospheric, Great Soundtrack, Story Rich, First-Person, Sci-fi, Horror, FPS, Survival, Stealth, Dark, Survival Horror, Post-apocalyptic, 3D Vision, Linear, Based On A Novel, Benchmark",Mature,4A Games,79.0,2,https://media.rawg.io/media/games/120/1201a40e4364557b124392ee50317b99.jpg
7689,Rise of the Tomb Raider,2015-11-10,4.04,"Xbox One, PC, macOS, PlayStation 4",Action,"Singleplayer, Steam Achievements, Full controller support, Steam Cloud, Atmospheric, steam-trading-cards, Great Soundtrack, RPG, Story Rich, Open World, Third Person, Steam Leaderboards, Exploration, Female Protagonist, Survival, Stealth, Action-Adventure, Third-Person Shooter, Parkour, Quick-Time Events, Lara Croft",,"Feral Interactive, Crystal Dynamics, Nixxes",86.0,14,https://media.rawg.io/media/games/b45/b45575f34285f2c4479c9a5f719d972e.jpg
3287,Batman: Arkham Knight,2015-06-23,4.24,"PC, Nintendo Switch, Xbox One, PlayStation 4",Action,"Singleplayer, Steam Achievements, Full controller support, Steam Cloud, Atmospheric, steam-trading-cards, Story Rich, Open World, Third Person, Horror, Steam Leaderboards, Sandbox, Stealth, Dark, Mature, Beat 'em up, Detective, Comic Book, Superhero, Batman",Mature,Rocksteady Studios,81.0,19,https://media.rawg.io/media/games/310/3106b0e012271c5ffb16497b070be739.jpg
3192,Metal Gear Solid V: The Phantom Pain,2015-09-01,4.16,"PlayStation 4, PC, Xbox One, PlayStation 3, Xbox 360","Action, Shooter","Singleplayer, Steam Achievements, Multiplayer, Full controller support, Steam Cloud, Atmospheric, steam-trading-cards, Great Soundtrack, Story Rich, Open World, Third Person, Sci-fi, Steam Leaderboards, Sandbox, Stealth, Tactical, Third-Person Shooter, Dark, Captions available, Replay Value, Cinematic, Heist, Horses",Mature,Kojima Productions,91.0,22,https://media.rawg.io/media/games/490/49016e06ae2103881ff6373248843069.jpg
290856,Apex Legends,2019-02-04,3.64,"PlayStation 4, Nintendo Switch, macOS, PC, Xbox One","Action, Shooter","Multiplayer, Full controller support, Atmospheric, Co-op, First-Person, Sci-fi, FPS, Online Co-Op, Exploration, Survival, Free to Play, Action-Adventure, Tactical, Dark, PvP, Character Customization, Cinematic, combat, Team-Based, Cyberpunk, Battle Royale, Hero Shooter, lootboxes",Teen,Respawn Entertainment,80.0,5,https://media.rawg.io/media/games/737/737ea5662211d2e0bbd6f5989189e4f1.jpg
16944,The Witcher 2: Assassins of Kings Enhanced Edition,2012-04-16,4.16,"macOS, PC, Xbox 360",RPG,"Singleplayer, Steam Achievements, Steam Cloud, Atmospheric, steam-trading-cards, RPG, Story Rich, Open World, Third Person, Partial Controller Support, Fantasy, Difficult, Steam Leaderboards, Dark, Nudity, Choices Matter, Dark Fantasy, Mature, Medieval, Magic, Multiple Endings, Based On A Novel, Nonlinear",Mature,CD PROJEKT RED,88.0,7,https://media.rawg.io/media/games/6cd/6cd653e0aaef5ff8bbd295bf4bcb12eb.jpg
416,Grand Theft Auto: San Andreas,2004-10-26,4.51,"macOS, PC, iOS, Xbox, Android, PlayStation 4, PlayStation 3, PlayStation 2, Xbox 360, Xbox One",Action,"Singleplayer, Multiplayer, Atmospheric, Great Soundtrack, Story Rich, Open World, Third Person, Partial Controller Support, Funny, Classic, Sandbox, Comedy, Moddable, Mature, Crime, Driving, first person mod, Remote Play on Tablet, Remote Play on Phone, controversial, karaihb",Mature,"Rockstar North, War Drum Studios",93.0,2,https://media.rawg.io/media/games/960/960b601d9541cec776c5fa42a00bf6c4.jpg
11973,Middle-earth: Shadow of Mordor,2014-09-30,3.9,"Linux, Xbox One, Xbox 360, PlayStation 3, PlayStation 4, macOS, PC","Action, RPG","Singleplayer, Steam Achievements, Full controller support, Steam Cloud, Atmospheric, steam-trading-cards, RPG, Story Rich, Open World, Third Person, Fantasy, Gore, Sandbox, Stealth, Action RPG, Hack and Slash, Dark Fantasy, Magic, Parkour, Assassin, Lore-Rich, Based On A Novel, steam, category, microtranzations",Mature,"Feral Interactive, Monolith Productions",85.0,13,https://media.rawg.io/media/games/d1a/d1a2e99ade53494c6330a0ed945fe823.jpg
23027,The Walking Dead: Season 1,2012-04-23,4.36,"Android, PS Vita, macOS, PC, iOS, PlayStation 4, PlayStation 3, Xbox 360, Nintendo Switch, Xbox One","Action, Adventure","Singleplayer, Full controller support, Atmospheric, Story Rich, Third Person, Horror, Gore, Survival, Zombies, Point & Click, Post-apocalyptic, Choices Matter, Mature, Visual Novel, Drama, Episodic, Comic Book, Choose Your Own Adventure, Quick-Time Events",Mature,Telltale Games,92.0,8,https://media.rawg.io/media/games/8d6/8d69eb6c32ed6acfd75f82d532144993.jpg
9767,Hollow Knight,2017-02-23,4.4,"PlayStation 4, Linux, macOS, PC, Nintendo Switch, Xbox One","Action, Indie, Platformer","Singleplayer, Steam Achievements, Full controller support, Steam Cloud, Atmospheric, steam-trading-cards, Great Soundtrack, Story Rich, Open World, 2D, Difficult, Exploration, Controller, controller support, Cute, Dark Fantasy, Side Scroller, Multiple Endings, Metroidvania, Hand-drawn, Gothic",Everyone 10+,Team Cherry,88.0,7,https://media.rawg.io/media/games/4cf/4cfc6b7f1850590a4634b08bfab308ab.jpg
41,Little Nightmares,2017-04-27,4.04,"iOS, PlayStation 4, PC, Xbox One, Nintendo Switch","Action, Adventure, Platformer","Singleplayer, Steam Achievements, Full controller support, Steam Cloud, Atmospheric, steam-trading-cards, Great Soundtrack, Story Rich, Third Person, Horror, Female Protagonist, Stealth, Dark, Survival Horror, controller support, Short, achievements, Puzzle-Platformer, 2.5D",,"BANDAI NAMCO Entertainment America, Playdigious, Tarsier Studios",81.0,3,https://media.rawg.io/media/games/8a0/8a02f84a5916ede2f923b88d5f8217ba.jpg
4427,BioShock 2,2010-02-09,4.07,"PlayStation 4, Xbox One, Nintendo Switch, PC, macOS, Xbox 360, PlayStation 3","Action, Shooter","Singleplayer, Steam Achievements, Multiplayer, Full controller support, Atmospheric, Great Soundtrack, RPG, Story Rich, First-Person, Sci-fi, Horror, FPS, Action RPG, Dark, Dystopian, Linear, Steampunk, Underwater, Philisophical",,"Feral Interactive, 2K, Digital Extremes, 2K Australia, 2K Marin, 2K China",88.0,3,https://media.rawg.io/media/games/157/15742f2f67eacff546738e1ab5c19d20.jpg
19710,Half-Life 2: Episode One,2006-06-01,4.38,"Linux, PC, Xbox 360, Android, macOS","Action, Shooter","Singleplayer, Steam Achievements, Steam Cloud, Atmospheric, Great Soundtrack, Story Rich, First-Person, Sci-fi, Partial Controller Support, FPS, Classic, stats, Zombies, Moddable, Captions available, Short, Cinematic, Aliens, Dystopian, Commentary available, Episodic, Includes Source SDK, Silent Protagonist",Mature,"Valve Software, NVIDIA Lightspeed Studios",87.0,4,https://media.rawg.io/media/games/7a2/7a2500ee8b2c0e1ff268bb4479463dea.jpg
19709,Half-Life 2: Episode Two,2007-10-10,4.45,"Android, Linux, macOS, PC, Xbox 360","Action, Shooter, Puzzle","Singleplayer, Steam Achievements, Multiplayer, Steam Cloud, Atmospheric, Great Soundtrack, Story Rich, First-Person, Sci-fi, Partial Controller Support, Horror, FPS, Classic, stats, Zombies, Post-apocalyptic, Captions available, Aliens, Dystopian, Commentary available, Episodic, Includes Source SDK, Silent Protagonist",Mature,"Valve Software, NVIDIA Lightspeed Studios",90.0,5,https://media.rawg.io/media/games/198/1988a337305e008b41d7f536ce9b73f6.jpg
2551,Dark Souls III,2016-04-11,4.4,"Xbox One, PlayStation 4, PC","Action, RPG","Singleplayer, Steam Achievements, Multiplayer, Full controller support, Atmospheric, steam-trading-cards, Great Soundtrack, RPG, Co-op, Story Rich, Open World, cooperative, Third Person, Horror, Difficult, Exploration, Action RPG, PvP, Character Customization, Replay Value, Dark Fantasy, Lore-Rich",Mature,"BANDAI NAMCO Entertainment America, FromSoftware",89.0,29,https://media.rawg.io/media/games/da1/da1b267764d77221f07a4386b6548e5a.jpg
10754,BioShock Remastered,2016-09-15,4.23,"PlayStation 4, Nintendo Switch, macOS, PC, Xbox One",Shooter,"Singleplayer, Steam Achievements, Full controller support, Steam Cloud, Atmospheric, Great Soundtrack, RPG, Story Rich, First-Person, Sci-fi, Horror, FPS, Classic, Dark, Dystopian, Remake, Steampunk, Commentary available, Alternate History, Underwater",Mature,"Feral Interactive, Digital Extremes, 2K Australia, 2K Marin, Virtuos, 2K China, Blind Squirrel, 2K Boston",,4,https://media.rawg.io/media/games/be0/be01c3d7d8795a45615da139322ca080.jpg
10035,Hitman,2016-03-11,3.92,"PlayStation 4, Linux, macOS, PC, Xbox One","Action, Shooter, Simulation","Singleplayer, Full controller support, Atmospheric, Great Soundtrack, Story Rich, Open World, Third Person, Sandbox, Stealth, Tactical, Third-Person Shooter, Nudity, Crime, Assassin, Episodic, Illuminati, Heist",Adults Only,"Feral Interactive, Square Enix, IO Interactive",83.0,7,https://media.rawg.io/media/games/16b/16b1b7b36e2042d1128d5a3e852b3b2f.jpg
4252,Mirror's Edge,2008-11-11,4.07,"Xbox 360, PlayStation 3, PC",Action,"Singleplayer, Full controller support, Atmospheric, Great Soundtrack, First-Person, Sci-fi, Partial Controller Support, Classic, Female Protagonist, Short, Colorful, Futuristic, Parkour, Dystopian, Stylized, Time Attack, european",Teen,Electronic Arts DICE,81.0,3,https://media.rawg.io/media/games/8e4/8e4de3f54ac659e08a7ba6a2b731682a.jpg
3612,Hotline Miami,2012-10-22,4.38,"Linux, Nintendo Switch, Xbox One, PlayStation 4, PS Vita, PC","Action, Shooter, Arcade, Indie","Singleplayer, Steam Achievements, Atmospheric, steam-trading-cards, Great Soundtrack, 2D, Partial Controller Support, Gore, Difficult, Violent, Pixel Graphics, Retro, controller support, Fast-Paced, Top-Down, overlay, Music, Surreal, Top-Down Shooter, 1980s, Psychedelic",,"Devolver Digital, Dennaton Games",85.0,5,https://media.rawg.io/media/games/9fa/9fa63622543e5d4f6d99aa9d73b043de.jpg
654,Stardew Valley,2016-02-25,4.4,"Nintendo Switch, Xbox One, PC, iOS, macOS, Linux, PlayStation 4, PS Vita, Android","RPG, Simulation, Indie","Singleplayer, Steam Achievements, Multiplayer, Steam Cloud, Atmospheric, steam-trading-cards, Great Soundtrack, RPG, Co-op, Open World, 2D, Partial Controller Support, Sandbox, Pixel Graphics, Retro, role-playing, Cute, Crafting, Building, overlay, Relaxing, Dating Sim, Shared/Split Screen Co-op, cloud saves, Fishing, Agriculture, co-op multiplayer",Everyone 10+,"Chucklefish, ConcernedApe",89.0,13,https://media.rawg.io/media/games/713/713269608dc8f2f40f5a670a14b2de94.jpg
3790,Outlast,2013-09-03,3.74,"Linux, macOS, Nintendo Switch, PC, Xbox One, PlayStation 4","Action, Indie","Singleplayer, Steam Achievements, Full controller support, Steam Cloud, Atmospheric, steam-trading-cards, First-Person, Sci-fi, Horror, FPS, Gore, Difficult, Survival, Stealth, Dark, Nudity, Survival Horror, controller support, Captions available, Walking Simulator, Parkour, 3D Vision",Mature,Red Barrels,80.0,3,https://media.rawg.io/media/games/9dd/9ddabb34840ea9227556670606cf8ea3.jpg
1447,Deus Ex: Mankind Divided,2016-08-22,3.96,"Linux, PC, Xbox One, macOS, PlayStation 4","Action, RPG","Singleplayer, Full controller support, Atmospheric, Great Soundtrack, RPG, Story Rich, Open World, First-Person, Third Person, Sci-fi, FPS, Stealth, Futuristic, Cyberpunk, Dystopian, Illuminati, Conspiracy, Transhumanism",Mature,Eidos Montreal,83.0,7,https://media.rawg.io/media/games/00d/00d374f12a3ab5f96c500a2cfa901e15.jpg
10142,PlayerUnknown’s Battlegrounds,2017-12-20,3.27,"PC, Xbox One, PlayStation 4","Action, Shooter, Massively Multiplayer","Multiplayer, Co-op, Open World, cooperative, First-Person, FPS, Online Co-Op, Survival, Violent, Online multiplayer, Tactical, Third-Person Shooter, PvP, Battle Royale",,"Krafton, Bluehole, PUBG",81.0,29,https://media.rawg.io/media/games/1bd/1bd2657b81eb0c99338120ad444b24ff.jpg
10533,Path of Exile,2013-10-23,3.65,"Xbox One, PlayStation 4, PC","Action, RPG, Massively Multiplayer, Indie","Singleplayer, Steam Achievements, Multiplayer, steam-trading-cards, RPG, Co-op, cooperative, Online Co-Op, Fantasy, Free to Play, Online multiplayer, Action RPG, Hack and Slash, In-App Purchases, Character Customization, Dark Fantasy, mmo, Dungeon Crawler, MMORPG, PvE, Loot, Inventory Management, Fishing",,Grinding Gear Games,86.0,6,https://media.rawg.io/media/games/d0f/d0f91fe1d92332147e5db74e207cfc7a.jpg
